Judul,Alamat,Kamar Tidur,Luas Bangunan,Luas Lahan,Harga,Provinsi
Dar es Salaam Residence Tipe 69,Jatiwangi Majalengka,3,69,120,650000000,Jawa Barat
Golden Park 2 Tipe New Amarilis,Cisauk Tangerang,2,50,60,960775650,Banten
Golden Park 2 Tipe Edelweiss,Cisauk Tangerang,3,60,71,1199890750,Banten
Golden Park 2 Tipe Mahogany,Cisauk Tangerang,3,88,105,1595530000,Banten
Golden Park 3 Tipe Hermes,Cisauk Tangerang,3,58,60,960400000,Banten
Metland Cileungsi Tipe Adenia,Cileungsi Bogor,2,48,72,691020000,Jawa Barat
Cluster The Laurus Tipe 2 Harvest City,Cileungsi Bogor,2,60,105,1068840000,Jawa Barat
Latinos Business District Tipe 91,Serpong Tangerang Selatan,2,91,50,1837709000,Banten
Tipe Boston Timur Mutiara Columbus,Mustika Jaya Bekasi,2,36,72,531000000,Jawa Barat
Tipe Montana Mutiara Columbus,Mustika Jaya Bekasi,2,45,90,657000000,Jawa Barat
Tipe Manchester Mutiara Columbus,Mustika Jaya Bekasi,3,60,120,822850000,Jawa Barat
Tipe Maple Mutiara Columbus,Mustika Jaya Bekasi,3,69,90,935000000,Jawa Barat
Tipe Boston Cifest,Cikarang Selatan Bekasi,2,36,72,564350000,Jawa Barat
Tipe Magnolia Cifest,Cikarang Selatan Bekasi,2,55,60,674750000,Jawa Barat
Tipe New Derby Cifest,Cikarang Selatan Bekasi,2,27,60,457400000,Jawa Barat
Tipe Birmingham Cifest,Cikarang Selatan Bekasi,2,45,90,739150000,Jawa Barat
Tipe Ebony Cifest,Cikarang Selatan Bekasi,2,36,72,565500000,Jawa Barat
Cluster Sakura Indica Tipe Megame Harvest City,Cileungsi Bogor,2,37,72,644280000,Jawa Barat
Metland Cibitung Cluster Spring Terrace Tipe 38,Cibitung Bekasi,2,38,72,500000000,Jawa Barat
Graha Tirta Asri Tipe Lily,Ciseeng Bogor,2,36,72,520000000,Jawa Barat
rumah full furnish cluster Thompson Summarecon gading serpong,Gading Serpong Tangerang,3,73,77,2100000000,Banten
Jual Rumah 2 Lantai Cibubur Tipe LB 40 LT 85,Tapos Depok,2,40,85,734250000,Jawa Barat
Dijual Rumah 2 Lantai di Duta Graha Bebas Banjir Harga Nego J 18062,Harapan Indah Bekasi,3,130,105,1600000000,Jawa Barat
Mutiara Damai Cipayung Tipe C,Cipayung Jakarta Timur,4,152,142,3011820000,DKI Jakarta
Seminyak Suites,Seminyak Badung,2,116,128,3900000000,Bali
Virginia Park Makassar Tipe Blossom,Biringkanaya Makassar,3,73,72,862561331,Unknown
Bintaro Jaya Sektor 9,Bintaro Tangerang Selatan,3,170,170,3200000000,Banten
Rumah Caspia BSD City,Bumi Serpong Damai Tangerang Selatan,3,120,112,2300000000,Banten
rumah illustria the eminent BSD,Bumi Serpong Damai Tangerang Selatan,3,92,112,2300000000,Banten
rumah baru di naara village paramount gading serpong,Gading Serpong Tangerang,3,116,120,3500000000,Banten
dipasarkan rumah di illustria eminent bsd 5 menit ke pintu tol,Bumi Serpong Damai Tangerang Selatan,3,114,160,2800000000,Banten
3 kama tidur cluster precia eminent bsd city dekat akses tol,Bumi Serpong Damai Tangerang Selatan,3,142,120,2800000000,Banten
Rumah di Kencana Ext cluster nyaman dan Hidup,Bumi Serpong Damai Tangerang Selatan,3,123,80,1850000000,Banten
Rumah di Neo Catalonia Bsd Baru Bangun Dekat Taman,Bumi Serpong Damai Tangerang Selatan,4,150,98,2250000000,Banten
prestigia the eminent BSD,Bumi Serpong Damai Tangerang Selatan,3,125,120,3200000000,Banten
Jual Cepat Sheffield Greenwich BSD type 8 Rapih Siap Huni,Bumi Serpong Damai Tangerang Selatan,3,130,160,3500000000,Banten
Rumah SHM Rapi GreenWich Park Cluster SHEFFIELD BSD City Tangerang,Bumi Serpong Damai Tangerang Selatan,3,130,160,3500000000,Banten
rumah di bsd city sheffield greenwich park harga nego,Bumi Serpong Damai Tangerang Selatan,3,130,160,3600000000,Banten
Jual Cepat Avezza Mozia BSD renov hadap Timur,Bumi Serpong Damai Tangerang Selatan,2,90,72,1700000000,Banten
jual rumah Inspirahaus Tabebuya BSD,Bumi Serpong Damai Tangerang Selatan,2,48,48,1150000000,Banten
Rumah Sheffield Greenwich BSD,Bumi Serpong Damai Tangerang Selatan,3,171,180,4000000000,Banten
The Terrace at Ayodhya Garden Tipe Oak,Cikokol Tangerang,2,63,50,1250000000,Banten
Rumah Sheffield Greenwich BSD,Bumi Serpong Damai Tangerang Selatan,4,130,160,3500000000,Banten
dijual rumah illustria The Eminent BSD,Bumi Serpong Damai Tangerang Selatan,3,92,126,2350000000,Banten
Rumah The Icon di Cluster East Cosmo Sangat Dicari Jarang Ada,Sampora Tangerang,3,88,128,2300000000,Banten
illustria The Eminent BSD,Bumi Serpong Damai Tangerang Selatan,3,92,126,2500000000,Banten
Cluster De Nara De Park BSD,Bumi Serpong Damai Tangerang Selatan,4,120,170,3500000000,Banten
rumah di bsd city mayfield greenwich park type L8m harga termurah,Bumi Serpong Damai Tangerang Selatan,3,130,160,3400000000,Banten
jual cepat Rumah Whelford Greenwich BSD,Bumi Serpong Damai Tangerang Selatan,3,120,60,1600000000,Banten
Dijual Rumah Puspita Loka,Lengkong Gudang Tangerang,3,100,140,2600000000,Banten
Jual atau Sewa Rumah Eminent Cluster Ingenia,Pagedangan Tangerang,3,114,144,2650000000,Banten
Cluster Askara Nue Vanya Park,Pagedangan Tangerang,3,89,77,2700000000,Banten
Bsd Greenwich Cluster Whitsand Jarang SekaLi Ada,Pagedangan Tangerang,4,150,160,3500000000,Banten
Rumah Vivacia Eminent BSD City Semi Furnished Lokasi Strategis Dekat,Pagedangan Tangerang,3,110,128,2950000000,Banten
Delatinos BSD City,Rawa Buntu Tangerang Selatan,3,120,136,2300000000,Banten
rumah di jual 2 lantai turun harga di the icon bsd city,Bumi Serpong Damai Tangerang Selatan,3,200,119,2500000000,Banten
Rumah Depok 8 Menit Tol Cimanggis 10 Menit RS Meilia Cibubur DP Ringan,Cimanggis Depok,2,36,61,550000000,Jawa Barat
Rumah Siap Huni di Pondok Ungu Permai Free biaya baliknama dan KPR,Bekasi Utara Bekasi,3,60,78,710000000,Jawa Barat
Rumah Minimalis dekat dengan fasilitas Kesehaatan Siap KPR J 16775,Bintaro Tangerang Selatan,2,70,99,1610000000,Banten
Hunian Cantik Harga Terjangkau di Pulo Gadung Jakarta Timur,Pulo Gadung Jakarta Timur,3,72,45,954900000,DKI Jakarta
Sektor 1 Bintaro Jaya,Bintaro Jakarta Selatan,3,120,135,2700000000,DKI Jakarta
Rumah kluster Nusa Loka BSD semi furnished dekat tol,Bumi Serpong Damai Tangerang Selatan,2,65,72,1600000000,Banten
Rumah Dekat Jalan Raya 5 Menit RSUD Depok 10 Menit Tol Cimanggis DP 0,Tapos Depok,2,40,63,565000000,Jawa Barat
Rumah Ready Tanpa DP,Serpong Tangerang Selatan,3,80,68,1600000000,Banten
Perumahan Modern Cempaka Putih 2 lantai Dijual SHM pinggir Jalan,Johar Baru Jakarta Pusat,3,106,76,3400000000,DKI Jakarta
Baru di Griya Loka KT 4 1 bisa KPR sudah SHM,Bumi Serpong Damai Tangerang Selatan,4,200,144,2950000000,Banten
Rumah Minimalist dan Luas hanya 890 juta 5 menit dari Jakarta,Pondok Melati Bekasi,3,140,168,890000000,Jawa Barat
Rumah 3 Kamar Luas 110 m2 DP NOL Cicil 3 Juta Dekat TOL Stasiun KRL,Bogor Tengah Kota Bogor,3,40,110,589000000,Jawa Barat
Dijual Cepat Perumahan Bintaro Sektor 9 Harga NJOP,Bintaro Tangerang Selatan,3,78,72,2100000000,Banten
Rumah Dijual Murah di Bintara Free biaya biaya,Bintara Bekasi,2,60,78,990000000,Jawa Barat
Rumah dijual mewah lokasi strategis di jakarta pusat cempaka putih,Cempaka Putih Jakarta Pusat,3,94,53,2270000000,DKI Jakarta
Rumah Full Furnished Siap Huni Sudah di Renovasi Cluster Rossini,Gading Serpong Tangerang,4,106,84,2800000000,Banten
Rumah Minimalis di Perumahan Erfina Regency Siap KPR Bisa Nego J 19436,Cibinong Bogor,3,100,155,1730000000,Jawa Barat
Rumah Strategis hanya 7 menit ke Pasar Rawa Buaya Siap KPR J 20006,Cengkareng Jakarta Barat,3,100,120,1610000000,DKI Jakarta
Dijual Rumah Minimalis dengan SHM di Komplek Kresek Bisa KPR J 20427,Cengkareng Jakarta Barat,3,120,120,1610000000,DKI Jakarta
NEW CLUSTER HARVEST PONDOK CABE,Pondok Cabe Tangerang Selatan,3,112,90,1572000000,Banten
Rumah di Jual di Bogor Cluster Baru Cibinong Bogor,Nanggewer Bogor,2,36,76,535000000,Jawa Barat
Rumah Jatinegara Lio 2 Lantai Dijual SHM Deket stasiun Klender,Jatinegara Kaum Jakarta Timur,3,68,44,1000000000,DKI Jakarta
Di jual rumah di Pasar Rebo Jakarta Timur Lokasi Strategis,Pasar Rebo Jakarta Timur,2,60,85,1300000000,DKI Jakarta
Dijual Rumah di Kota Harapan Indah Harga Nego Siap Huni J 19967,Babelan Bekasi,3,150,88,1580000000,Jawa Barat
Jual Rumah Strategis Siap KPR di Perum Bukit Rivaria Sawangan J 19548,Sawangan Depok,2,85,105,800000000,Jawa Barat
Rumah Dijual di Vida Bumi Pala Grand Bekasi Siap Nego Bisa KPR J 16233,Tambun Selatan Bekasi,2,47,72,740000000,Jawa Barat
Exclusive Hunian Konsep Klasik Bali di Cilodong Depok,Cilodong Depok,2,40,63,645000000,Jawa Barat
Mutiara Gading City New Paris Tipe Le Verre,Setia Asih Bekasi,3,39,60,620000000,Jawa Barat
Mutiara Gading City Tipe Pianta,Tarumajaya Bekasi,3,42,108,651000000,Jawa Barat
Catha Rempoa Tipe Ziya,Ciputat Tangerang Selatan,3,75,66,1792000000,Banten
Cluster Alamanda Tipe 45 Samesta Parayasa,Parung Panjang Bogor,2,45,152,644000000,Jawa Barat
Prestige 2 Sawangan Tipe 52,Sawangan Depok,3,52,60,629000000,Jawa Barat
Serpong Garden Village Cluster Bougenville Tipe Alexandra,Parung Bogor,2,30,60,517730000,Jawa Barat
Clarity House Tipe Alex 7x12,Ciputat Tangerang Selatan,3,140,87,2130000000,Banten
Living Stone at Telaga Golf Tipe Deluxe,Sawangan Depok,3,135,124,1870000000,Jawa Barat
Mutiara Gading City Tipe Garnet,Tarumajaya Bekasi,2,36,72,569000000,Jawa Barat
De LORA Tipe 27,Parung Panjang Bogor,2,27,60,497550000,Jawa Barat
Cluster Victoria Green Residence Tipe Florence,Setia Mulya Bekasi,2,27,72,545454545,Jawa Barat
Vasaka City Tipe 45 84,Sukawangi Bekasi,2,45,84,495400000,Jawa Barat
Premier Promenade Tipe Violet,Pancoran Mas Depok,3,82,72,1625000000,Jawa Barat
Tipe Minimalis 54 64 Taman Jatisari Permai,Jatiasih Bekasi,2,54,64,1122940000,Jawa Barat
Premier Promenade Tipe Orchid,Pancoran Mas Depok,3,95,84,1888000000,Jawa Barat
Prestige Pondok Cabe Tipe 52,Sawangan Depok,3,52,60,695000000,Jawa Barat
Paramount New Amarillo Village Tipe L5,Pagedangan Tangerang,2,53,40,1037100000,Banten
Cluster Margata Tipe Tiffany Badan Cimanggis Golf Estate,Tapos Depok,3,128,117,2849000000,Jawa Barat
Green Valley Estate Serang Tipe 36,Taktakan Serang,2,36,60,301000000,Banten
Kota Podomoro Tenjo Tipe Deluxe 27,Tenjo Bogor,2,27,60,183260000,Jawa Barat
Park Serpong Tipe Y,Legok Tangerang,2,40,31,461689222,Banten
Nirwana Hill Bogor Tipe 36,Gunung Sindur Bogor,2,36,72,700000000,Jawa Barat
Sutera Sawangan Tipe Garnet,Bojongsari Depok,3,103,96,1679000000,Jawa Barat
Graha Tirta Asri Tipe Teratai,Ciseeng Bogor,2,45,91,616000000,Jawa Barat
Cluster New Bougenville Tipe 36 Samesta Parayasa,Parung Panjang Bogor,2,36,72,476000000,Jawa Barat
Telaga Kahuripan Cluster Aluna Tipe 9,Kemang Bogor,4,155,135,2253300000,Jawa Barat
Naira Residence 2 Lake View Tipe Como B,Cisauk Tangerang,3,60,77,1148000000,Banten
RUMAH PONDOK HIJAU GOLF GADING SERPONG HUK LEBAR 8 RENOV,Gading Serpong Tangerang,4,170,135,2950000000,Banten
Jual Rumah 2 Lantai Cluster Edison Scientia Gading Serpong,Gading Serpong Tangerang,4,128,120,2700000000,Banten
Jual Cepat Rumah 2 Lantai Cluster Magnolia L Agricola Gading Serpong,Gading Serpong Tangerang,4,162,153,3000000000,Banten
RUMAH GADING SERPONG SIAP HUNI MODERN CLASSIC SIAP HUNI BRAND NEW,Gading Serpong Tangerang,4,150,136,3100000000,Banten
Jual Murah Rumah 2 Lantai Cluster Elista Village Gading Serpong,Gading Serpong Tangerang,3,77,60,1300000000,Banten
Rumah Baru 1 Lantai Kencana Loka BSD City,Bumi Serpong Damai Tangerang Selatan,3,70,84,1350000000,Banten
Jual Cepat Rumah 1 1 4 Lantai Nusaloka Sektor 14 BSD City,Bumi Serpong Damai Tangerang Selatan,3,100,120,1600000000,Banten
Rumah Rapih Siap Huni Cluster Vivacia Lebar 8 The Eminent BSD,Pagedangan Tangerang,3,144,128,3100000000,Banten
RUMAH MODERN GADING SERPONG MILANO SIAP HUNI CAKEP MURAH,Gading Serpong Tangerang,3,65,84,1500000000,Banten
Termurah Rumah 2 Lantai Cluster Aure The Mozia BSD City,Bumi Serpong Damai Tangerang Selatan,4,135,120,3300000000,Banten
RUMAH CLUSTER PRECIA THE EMINENT BSD,Bumi Serpong Damai Tangerang Selatan,3,144,120,3200000000,Banten
RUMAH READY FREE PPN 100,Karawaci Tangerang,4,77,72,955000000,Banten
Rumah Murah 2 Lantai 3 Kt dekat CBD Graha Raya Bintaro bisa KPR DP 0,Bintaro Tangerang Selatan,3,60,60,1100000000,Banten
Rumah Murah 2 Lantai 3 Kt dekat CBD Ciledug Raya bisa KPR DP 0 SHM,Ciledug Tangerang,3,60,60,1100000000,Banten
Rumah Ready Stock 2 Lantai 3 Kt dekat CBD Alam Sutera bisa KPR DP 0,Alam Sutera Tangerang Selatan,3,60,60,1100000000,Banten
Dijual Rumah siap huni type 60 110,Gianyar Gianyar,3,60,110,625000000,Bali
Dijual Rumah Hoek di Perumahan Citra Maja 2 Cluster Pecatu,Maja Lebak,1,22,88,200000000,Banten
Rumah Siap KPR di Vida Bumi Pala Grand Bekasi Harga All In KPR J 16233,Mustika Jaya Bekasi,2,47,72,740000000,Jawa Barat
Jual Rumah di Legenda Wisata Strategis Dekat Mall Harga Nego J 16083,Cibubur Jakarta Timur,3,140,180,2110000000,DKI Jakarta
Daru Metropolis Cluster Edinburgh Tipe 52 96,Jambe Tangerang,3,52,96,456487801,Banten
Golden Hills Tipe Andalusia,Gunung Sindur Bogor,3,60,98,1151000000,Jawa Barat
Daru Metropolis Cluster Helsinki Tipe 27 72,Jambe Tangerang,2,27,72,280920087,Banten
Daru Metropolis Cluster Catania Tipe 52 96,Jambe Tangerang,3,52,96,456487801,Banten
Mutiara Gading City Tipe Clover,Tarumajaya Bekasi,2,60,52,865000000,Jawa Barat
Synthesis Homes Tipe Paras Courtyard,Ciputat Tangerang Selatan,4,87,70,2360970000,Banten
Golden Vista Tipe Venesia,Legok Tangerang,2,31,60,482829487,Banten
Mutiara Gading City Tipe Bluebell,Tarumajaya Bekasi,3,62,84,1375000000,Jawa Barat
Mustika Village Sukamulya Tipe Hana Premium,Cikarang Bekasi,2,60,30,255750000,Jawa Barat
Mutiara Gading City Tipe Grand Pianta,Tarumajaya Bekasi,3,42,119,651000000,Jawa Barat
Golden Park 3 Tipe New Oryza,Cisauk Tangerang,3,51,60,969000000,Banten
Golden City Cluster Greenwood Tipe Redwood Hoek,Teluk Pucung Bekasi,4,133,120,1940231170,Jawa Barat
Golden Cikeas Tipe Rinjani,Gunung Putri Bogor,2,33,72,667132200,Jawa Barat
Golden Cikeas Tipe Semeru,Gunung Putri Bogor,2,30,60,575424000,Jawa Barat
Golden City Cluster Diamond Tipe Jade Hoek,Teluk Pucung Bekasi,2,60,91,1181292525,Jawa Barat
Golden City Cluster Diamond Tipe Crystal Hoek,Teluk Pucung Bekasi,3,63,92,1203320475,Jawa Barat
Kota Sutera Cluster Britania Tipe 36,Pasar Kemis Tangerang,2,36,66,440800000,Banten
Cluster Victoria Elok Tipe Azalea,Setia Mulya Bekasi,2,30,66,369655000,Jawa Barat
Grand Tenjo Residence Oakwood Suite,Tenjo Bogor,2,31,60,422429000,Jawa Barat
Synthesis Homes Tipe Andesit,Ciputat Tangerang Selatan,4,106,90,2884890000,Banten
Cluster Bhumi Anvaya Villa House Tipe Agra Prime,Babakan Madang Bogor,3,125,120,2090000000,Jawa Barat
Grand Safira Tipe 36,Cengkeh Turi Binjai,2,36,91,200000000,Unknown
Grand Tenjo Residence Cluster Oakwood Tipe Luxe,Tenjo Bogor,3,55,72,746807000,Jawa Barat
Parkville Cluster Toscana Tipe Sierra,Bogor,2,66,60,1043000000,Jawa Barat
Grand Tenjo Residence Cluster Botanica Tipe 34 72,Tenjo Bogor,2,34,72,399489000,Jawa Barat
Cluster Miami Tipe 9,Gunung Putri Bogor,3,164,162,2808355000,Jawa Barat
Grand Duta City West Manhattan Tipe Tribeca,Babelan Bekasi,2,47,72,808384500,Jawa Barat
Grand Wisata Z Living Tipe Modern,Mustika Jaya Bekasi,3,88,66,1679401062,Jawa Barat
Cluster Bellwood Tipe 107 98,Gunung Putri Bogor,3,107,98,1716585000,Jawa Barat
Paramount Petals Tipe L6x12,Curug Tangerang,3,51,72,980000000,Banten
Virya Semanan Tipe 6,Cengkareng Jakarta Barat,3,136,120,2973300000,DKI Jakarta
Lavesh Phase 2 Kota Harapan Indah Tipe Arvinza Sudut 57 hoek,Tarumajaya Bekasi,3,57,122,1965000000,Jawa Barat
Grand Batavia 2 Cluster Sirena Tipe Selena,Pasar Kemis Tangerang,2,31,60,456490585,Banten
Serpong Green Paradise Tipe Dahlia,Parung Panjang Bogor,2,30,60,305718000,Jawa Barat
Graha Raya Cluster Vazza Tipe 5 x 12,Serpong Tangerang Selatan,2,69,60,1294300000,Banten
Perumnas Samesta Dramaga Bogor Tipe 36 84,Cibungbulang Bogor,2,36,84,361860000,Jawa Barat
Paradise Serpong City 2 Ecospace Tipe Skye,Gunung Sindur Bogor,3,85,85,1445000000,Jawa Barat
Panorama Sepatan 1 Tipe 65 70,Sepatan Timur Tangerang,4,65,70,773125000,Banten
Paradise Serpong City Tipe Arbor,Serpong Tangerang Selatan,3,66,75,1300000000,Banten
Lavesh Phase 2 Kota Harapan Indah Tipe Arneva Standar 55 75,Tarumajaya Bekasi,2,55,75,1432000000,Jawa Barat
Metland Cibitung Cluster Barcelona Cove Tipe 38 72,Bekasi,2,38,72,684264706,Jawa Barat
Bali Resort Bogor Uluwatu Ext Tipe 85,Ranca Bungur Bogor,3,85,87,981989000,Jawa Barat
Bali Resort Extension Tipe Bali Haus,Gunung Sindur Bogor,3,72,60,884200000,Jawa Barat
Grand Alifia Bogor Tipe Amaryllis 72 60,Tanah Sareal Bogor,3,72,60,695043750,Jawa Barat
Fortunia Residences 2 Tipe Willow 6x12,Pamulang Tangerang Selatan,4,86,87,2124540000,Banten
Summarecon Crown Gading Cluster Regia tipe 7 x 13,Setia Asih Bekasi,3,80,91,1576200000,Jawa Barat
PIK 2 Bukit Nirmala Tipe Kencana,Penjaringan Jakarta Utara,3,124,75,3447000000,DKI Jakarta
Cluster Victoria Permai Tipe Elok,Setia Mulya Bekasi,2,27,60,466375000,Jawa Barat
Mutiara Columbus Tipe Boston,Mustika Jaya Bekasi,2,36,72,596000000,Jawa Barat
Mutiara Columbus Tipe New Derby,Mustika Jaya Bekasi,2,27,60,381000000,Jawa Barat
PIK 2 Sapporo Residence Tipe Ayaka,Pantai Indah Kapuk Jakarta Utara,3,124,60,2879000000,DKI Jakarta
Graha Laras Sentul Cluster Munich Tipe 69 105,Sukaraja Bogor,3,69,105,1760010000,Jawa Barat
Avoria Estate Cluster Barlia 2 lantai Tipe 80 90,Kemang Bogor,3,80,90,915072000,Jawa Barat
Golden Hills Tipe Assisi,Gunung Sindur Bogor,2,30,60,672000000,Jawa Barat
Grand Surya Estate Tipe Bourke,Duren Jaya Bekasi,3,73,84,1269956089,Jawa Barat
Emerald City Tipe Sapphire,Cibinong Bogor,2,62,72,862820000,Jawa Barat
Citaville Pilar Cikarang Tipe Belfast,Karangbahagia Bekasi,2,38,66,449800000,Jawa Barat
PIK 2 Villa Pasir Putih 10 Tipe 8x10,Jakarta Utara,3,181,80,3282000000,DKI Jakarta
Perumnas Samesta Dramaga Bogor Tipe 36 90,Cibungbulang Bogor,2,36,90,378510000,Jawa Barat
BSD City Tanakayu Svasti Tipe 6,Pagedangan Tangerang,3,86,66,2393246000,Banten
PIK 2 Bukit Nirmala Tipe Azalea,Penjaringan Jakarta Utara,2,75,45,2073000000,DKI Jakarta
,Babelan Bekasi,2,39,60,667590000,Jawa Barat
PIK 2 Sapporo Residence Tipe Azumi,Pantai Indah Kapuk Jakarta Utara,2,95,50,2319000000,DKI Jakarta
Milestone at Memora House Tipe 7x12,Pamulang Tangerang Selatan,3,125,84,1655000000,Banten
The Nove Tipe Townhouse Nuvasa Bay,Nongsa Batam,2,107,105,2100000000,Unknown
JESS Residence Tipe Rome 5x12,Menganti Gresik,2,52,60,831875500,Jawa Timur
Paradise Serpong City Tipe Fresia,Serpong Tangerang Selatan,2,61,100,1670000000,Banten
Golden Park 3 Tipe Luna,Cisauk Tangerang,3,90,84,1489000000,Banten
Bumi Bantar Panjang Tipe Aster,Tigaraksa Tangerang,2,30,60,320000000,Banten
BSD City The Blizfield Tipe 8,Pagedangan Tangerang,4,146,112,3929994000,Banten
Ikon Tenjo Resort Homes Tipe Aralia A Komersil,Tenjo Bogor,1,23,60,273620000,Jawa Barat
Kota Podomoro Tenjo Cluster Damar Tipe 40,Tenjo Bogor,2,40,119,582908000,Jawa Barat
Springhill Yume Lagoon Tipe Tsubaki,Cisauk Tangerang,2,46,72,866355000,Banten
Aquila Valley Tipe Garuda Prime,Ciseeng Bogor,2,32,60,446400000,Jawa Barat
Golden City Cluster Greenwood Tipe Cedar Hoek Plus,Teluk Pucung Bekasi,3,68,90,1227364750,Jawa Barat
Suma Village Tipe 5,Curug Tangerang,2,55,60,819674000,Banten
Lagoosi Village Tipe Zamora,Mandai Maros,2,60,66,647000000,Unknown
Bintaro Land Tipe Milano,Ciputat Tangerang Selatan,3,150,119,2300000000,Banten
Taman Jatisari Permai Tipe 150,Jatiasih Bekasi,4,150,162,2765000000,Jawa Barat
Kemang Verde Tipe 73 60,Bogor,3,73,60,612500000,Jawa Barat
Avoria Estate Cluster Barlia 2 lantai Tipe 88 90,Kemang Bogor,3,88,90,967776000,Jawa Barat
Golden Gemilang Bekasi Tipe Jasmine,Cibitung Bekasi,3,47,84,677642750,Jawa Barat
Paramount Land Fresco Cluster British Tipe L5,Gading Serpong Tangerang,2,53,60,1145800000,Banten
Fortunia Residences 2 Tipe Oak 5x12 Hoek,Pamulang Tangerang Selatan,3,73,81,1895880000,Banten
Cendana Essence Residence Tipe 2,Curug Tangerang,3,68,82,1482913066,Banten
Graha Taruma Tipe Nara,Cirendeu Tangerang Selatan,2,100,59,1821721850,Banten
Griya Permata Tonjong Tipe Ruby,Tajurhalang Bogor,2,45,84,453435000,Jawa Barat
Rumah tanpa Dp di Karawang,Cirejag Karawang,2,36,72,370000000,Jawa Barat
Dekat Toll Aeon BSD Rumah Rapih Terawat Cluster Cosmo The Icon,Sampora Tangerang,3,79,119,2150000000,Banten
Tanpa DP rumah 2 Lantai cluster Assana Starlight Vanya Park BSD City,Pagedangan Tangerang,2,52,77,1620000000,Banten
Jual Cepat Rumah 2 Lantai Cluster Boston Village Gading Serpong,Gading Serpong Tangerang,3,80,60,1680000000,Banten
RUMAH COMPACT MODERN GADING SERPONG SIAP HUNI JUAL MURAH,Gading Serpong Tangerang,3,87,90,1675000000,Banten
Rumah Semi Furnished Cluster ILLUSTRIA The Eminent BSD,Pagedangan Tangerang,3,160,180,4000000000,Banten
Bangunan tumbuh rumah 2 Lantai Cluster Lavender Gading Serpong,Gading Serpong Tangerang,3,87,119,2400000000,Banten
Type Master Rumah 2 Lantai Cluster Edison Scientia Gading Serpong,Gading Serpong Tangerang,3,114,105,2400000000,Banten
Dijual WTS Rumah Cluster Tesla,Gading Serpong Tangerang,2,62,66,1650000000,Banten
Serenade Lake Gading Serpong Paramount,Gading Serpong Tangerang,4,108,112,2000000000,Banten
Tanpa DP Rumah 3 Lantai Cluster Vasya Tanakayu BSD Furnished,Bumi Serpong Damai Tangerang Selatan,3,137,84,2933835625,Banten
Termurah Rumah 2 Lantai Cluster Prestigia The Eminent BSD City,Bumi Serpong Damai Tangerang Selatan,3,141,120,2700000000,Banten
Jual Cepat Rumah 2 Lantai Cluster Nittaya The Avani BSD CIty,Bumi Serpong Damai Tangerang Selatan,3,85,128,2200000000,Banten
Jual Cepat Furnished Rumah 2 Lantai Cluster Versailes BSD City,Bumi Serpong Damai Tangerang Selatan,3,180,144,3000000000,Banten
Termurah Rumah 2 lantai Cluster Amarine The Mozia BSD City,Bumi Serpong Damai Tangerang Selatan,2,65,60,1550000000,Banten
Gading Serpong Samara Village,Gading Serpong Tangerang,4,130,80,2300000000,Banten
Dijual Rumah Regensi Melati Mas,Bumi Serpong Damai Tangerang Selatan,3,50,68,850000000,Banten
Rumah moderen classic 2 lantai Free biaya KPR dekat GDC Cilodong Depok,Cilodong Depok,3,100,65,980000000,Jawa Barat
Townhouse baru dibelakang Paramount School,Bukit Sangkal Palembang,2,67,104,824500000,Unknown
Rumah Taman Ratu Jakarta Barat 3 lantai lokasi strategis,Duri Kepa Jakarta Barat,4,105,129,3000000000,DKI Jakarta
Hanya 2 5 Juta punya Rumah Cluster Mewah Cicilan 2 Jutaan,Parung Bogor,2,30,60,439000000,Jawa Barat
Darmawangsa Residence Cluster Singosari Tipe Srikandi,Tambun Utara Bekasi,3,55,78,925057000,Jawa Barat
Dijual rumah siap huni di Bumi Bintaro Permai dekat Tol J 18713,Bintaro Jakarta Selatan,3,180,140,2520000000,DKI Jakarta
Dijual cepat rumah MURAH strategis dekat Pondok Indah Jakarta Selatan,Pondok Indah Jakarta Selatan,3,145,78,3465475000,DKI Jakarta
Rumah Bebas Banjir di Griya Melati Mas 1 Harga Nego Siap KPR J 16109,Sukmajaya Depok,2,49,72,700000000,Jawa Barat
Rumah Strategis di Villa Mutiara Gading 2 Harga All In Nego J 20485,Tambun Utara Bekasi,3,115,60,1060000000,Jawa Barat
Rumah Minimalis Perum Karang Satria Green Residence Siap KPR J 20508,Tambun Utara Bekasi,2,108,108,830000000,Jawa Barat
Jual Rumah Minimalis 2 Lantai 10 menit ke Pasar Mini Ciputat J 11787,Ciputat Tangerang Selatan,3,130,96,1610000000,Banten
Jual Rumah di Taman Puri Cendana 15 menit ke Stasiun Tambun J 21039,Tambun Utara Bekasi,3,120,60,510000000,Jawa Barat
Dijual Rumah Seken Dekat Lebak Bulus Perumahan Bangun Lestari J 17553,Ciputat Tangerang Selatan,4,170,135,2250000000,Banten
Rumah 2 LT Gaya Bali 10 Menit Tol Cijago Cimanggis Promo Gratis Biaya,Cimanggis Depok,3,66,65,852000000,Jawa Barat
Rumah Strategis Bisa Nego Dekat Pintu Tol Bambu Apus Siap KPR J 15850,Cipayung Jakarta Timur,2,115,75,1610000000,DKI Jakarta
Rumah Strategis Siap Huni Dekat Stasiun Sudimara Siap KPR Nego J 21091,Pamulang Tangerang Selatan,2,49,105,1400000000,Banten
Dijual Rumah siap huni dalam perumahan elit Citra Grand Mutiara,Sleman Sleman,3,98,135,1250000000,DI Yogyakarta
Rumah Siap KPR 15 menit ke Gerbang Tol Brigif Bebas Banjir J 19539,Beji Depok,3,98,98,1370000000,Jawa Barat
Rumah Siap Huni Dijual di Perum Vida Bekasi Harga All In KPR J 20316,Bantar Gebang Bekasi,3,108,90,830000000,Jawa Barat
Jual Rumah Sudah Renovasi Cluster Emerald Town house Bintaro,Tangerang Selatan,4,110,84,2300000000,Banten
Dijual rumah baru full furnished di Kebayoran Residence Bintaro,Bintaro Tangerang Selatan,3,83,72,2200000000,Banten
Rumah Dijual Antapani Bandung Baru Renovasi,Antapani Bandung,3,97,90,975000000,Jawa Barat
Dijual Cepat BU Siap Huni Furnish Rumah Citra Raya Cikupa Tangerang,Cikupa Tangerang,2,45,84,1000000000,Banten
Dijual Rumah Modern Siap Huni Dekat UGM Jl Kaliurang KM 6 8,Sleman Sleman,4,180,111,1700000000,DI Yogyakarta
RUMAH JAPANESE STYLE DI JOGJA BARAT HANYA 250 JUTA SAJA,Sentolo Kulon Progo,2,36,70,250000000,DI Yogyakarta
Rumah Baru Dalam Cluster di Pondok Kelapa Jakarta Timur,Pondok Kelapa Jakarta Timur,3,160,102,2950000000,DKI Jakarta
Jual cepat bu rumah di komplek BTN paropo indah,Panakkukang Makassar,3,90,108,525000000,Unknown
dijual cepat rumah minimalis bagus prima aryana karawaci tangerang,Karawaci Tangerang,3,83,72,1100000000,Banten
Rumah Baru Taman Luas Dekat Tol Andara Sawangan Cinere Limo Depok,Rangkapan Jaya Depok,2,40,107,910000000,Jawa Barat
Dijual Rumah Hoek Minimalis di Perumahan Citra Maja 2 Pecatu,Maja Lebak,1,32,108,275000000,Banten
Rumah Terbaru di Jakarta Barat Dekat Bandara Cocok Untuk Milenial,Jakarta Barat,4,98,55,1800000000,DKI Jakarta
Rumah Syariah DP 0 Cuma 1 Km Ke Stasiun KRL Depok,Pancoran Mas Depok,3,50,38,599000000,Jawa Barat
Rumah Dijual Galaxy Bekasi Bebas Banjir di Cluster,Duren Sawit Jakarta Timur,4,117,100,1900000000,DKI Jakarta
Rumah Tanah Luas Rapi Siap Huni Furnish KPR Ringan Griya Loka BSD,Serpong Tangerang Selatan,2,80,90,1499999999,Banten
Jual Rumah di Duta Harapan Telaga Mas Strategis Dekat Babelan J 19312,Babelan Bekasi,3,110,60,1010000000,Jawa Barat
Dijual rumah seken di Cendana Residence Pamulang bisa KPR J 18425,Pamulang Tangerang Selatan,2,65,120,1560000000,Banten
