Judul,Alamat,Kamar Tidur,Luas Bangunan,Luas Lahan,Harga,Provinsi
Bsd Greenwich Cluster Whitsand Jarang SekaLi Ada,Pagedangan Tangerang,4,15,160,3500000000,Banten
Rumah Greenwich Furnish Cluster Sheffield Bsd City,Pagedangan Tangerang,3,130,160,3950000000,Banten
De Latinos BSD Rumah Rapih Siap Huni,Rawa Buntu Tangerang Selatan,2,100,112,1750000000,Banten
Dijual Cepat Foresta Naturale BSD City Rapi Jarang Ada Lokasi Str,Sampora Tangerang,4,140,112,2200000000,Banten
Foresta Cluster Fiore Bangunan Full Renovasi Bsd City,Sampora Tangerang,4,130,112,2300000000,Banten
Rumah Foresta Cluster Placido Lokasi Paling Strategis,Sampora Tangerang,3,190,128,3200000000,Banten
Regensi Melati Mas,Serpong Utara Tangerang Selatan,4,115,90,1500000000,Banten
Grand Pondok Ungu Tipe 37 72,Bekasi Utara Bekasi,2,37,72,761158913,Jawa Barat
Dijual Rumah Baru Minimalis Modern di Jl Lio Pulogadung Jakarta Timur,Jatinegara Kaum Jakarta Timur,3,68,44,1000274000,DKI Jakarta
Rumah cantik cempaka putih tengah,Cempaka Putih Jakarta Pusat,3,80,54,1940000000,DKI Jakarta
Rumah Siap Huni Cluster Caspia The Icon BSD,Sampora Tangerang,3,100,112,2150000000,Banten
Rumah Rapih Terawat Cluster Anantha The Avani BSD,Sampora Tangerang,3,140,160,3150000000,Banten
Rumah Cluster Western Cosmo Boulevard The Icon BSD,Sampora Tangerang,3,160,136,2875000000,Banten
Brand New Rumah Cluster Aether Greenwich Park BSD,Pagedangan Tangerang,4,165,98,3500000000,Banten
RUMAH 2LANTAI CICILAN 3JTAN,Curug Serang,2,61,60,715000000,Banten
Dijual rumah minimalis di Taman Sari Jakarta Barat,Taman Sari Jakarta Barat,2,39,20,485000000,DKI Jakarta
Promo Bisa KPR Tanpa DP Rumah Furnished Cluster Vasya Tanakayu BSD,Pagedangan Tangerang,3,137,84,3352955000,Banten
Omaha Davenport,Gading Serpong Tangerang,4,116,80,2100000000,Banten
Visana savia Nusaloka BSD,Bumi Serpong Damai Tangerang Selatan,4,107,140,2500000000,Banten
Jual Cepat Rumah 2 Lantai Gading Serpong Cluster Omaha Village,Gading Serpong Tangerang,3,120,96,1850000000,Banten
Jual Rumah 2 5 Lantai Cluster Omaha Gading Serpong,Gading Serpong Tangerang,3,116,80,2100000000,Banten
Jual Cepat Rumah 2 Lantai Cluster Martinez Gading Serpong,Gading Serpong Tangerang,3,80,83,1700000000,Banten
Jual Murah Rumah 2 Lantai Cluster Atlanta Village Gading Serpong,Gading Serpong Tangerang,3,82,80,1900000000,Banten
Jual Rumah 2 Lantai Cluster Anila Vanya Park BSD City,Bumi Serpong Damai Tangerang Selatan,3,72,77,1750000000,Banten
Furnished Rumah 2 Lantai Cluster Cosmo The Icon BSD City,Bumi Serpong Damai Tangerang Selatan,2,73,98,2000000000,Banten
Termurah Rumah 2 Lantai Cluster Cosmo The Icon BSD City,Bumi Serpong Damai Tangerang Selatan,3,88,128,2300000000,Banten
Jual Cepat Rumah 2 Lantai Cluster Ruby PHG Gading Serpong,Bumi Serpong Damai Tangerang Selatan,3,200,144,3000000000,Banten
Rumah Cluster Anila House Vanya Park BSD,Bumi Serpong Damai Tangerang Selatan,3,72,77,1800000000,Banten
Dijual Rumah Foresta Fiore,Bumi Serpong Damai Tangerang Selatan,4,135,112,2500000000,Banten
Rumah Cluster Visana Lebar 8 The Savia Nusa Loka BSD,Ciater Tangerang,4,133,144,2850000000,Banten
New Rumah 2 Lantai Griya Loka Sektor 1 4 BSD City,Bumi Serpong Damai Tangerang Selatan,4,200,144,2950000000,Banten
Jual Rumah Baru 2 Lantai Nusaloka BSD City Siap Huni,Bumi Serpong Damai Tangerang Selatan,4,130,135,2500000000,Banten
Semi Furnished Rumah 2 Lantai Anggrek Loka BSD City,Bumi Serpong Damai Tangerang Selatan,3,180,150,2800000000,Banten
Brand New Rumah 2 Lantai Nusaloka BSD City,Bumi Serpong Damai Tangerang Selatan,3,105,98,2200000000,Banten
Jual Rumah Rapih 1 Lantai Kencana Loka BSD City,Bumi Serpong Damai Tangerang Selatan,3,100,135,2100000000,Banten
Jual Cepat Rumah 2 lantai Cluster Amarilla Avani The Avani BSD,Bumi Serpong Damai Tangerang Selatan,3,100,144,2500000000,Banten
Jual Rumah 2 Lantai Cluster Alicante Gading Serpong,Gading Serpong Tangerang,3,164,180,3300000000,Banten
Brand new modern industrial Kencana Loka BSD,Bumi Serpong Damai Tangerang Selatan,4,180,120,2850000000,Banten
Dijual rumah BSD Sevilla park kencana loka,Bumi Serpong Damai Tangerang Selatan,2,62,72,1475000000,Banten
Rumah di bsd lokasi strategis siap huni depan taman Kawasan Foresta,Bumi Serpong Damai Tangerang Selatan,3,133,180,3800000000,Banten
Jual Cepat Rumah 2 Lantai Cluster Venetian The Green BSD City,Bumi Serpong Damai Tangerang Selatan,3,125,162,3200000000,Banten
Jual Rumah 1 Lantai Nusaloka Sektor 14 5 BSD City Siap Huni,Bumi Serpong Damai Tangerang Selatan,2,60,78,1250000000,Banten
Cluster Caspia the ICON BSD Dekat Tol dan Aeon Mall,Bumi Serpong Damai Tangerang Selatan,3,100,112,2150000000,Banten
DIJUAL MURAH GADING SERPONG,Gading Serpong Tangerang,2,128,128,1600000000,Banten
Dijual Rumah The Eminent Illustria BSD City,Bumi Serpong Damai Tangerang Selatan,4,114,144,2950000000,Banten
Jual Cepat Rumah 2 lantai Cluster Buenos Delatinos BSD City,Bumi Serpong Damai Tangerang Selatan,3,100,128,2000000000,Banten
Jual Cepat Rumah 2 Lantai cluster Buenos Park Delatinos BSD City,Bumi Serpong Damai Tangerang Selatan,2,69,96,1750000000,Banten
Jual Cepat Rumah 2 Lantai Cluster Azura Vanya Park BSD City,Bumi Serpong Damai Tangerang Selatan,2,65,60,1225000000,Banten
Jual Cepat Rumah BSD Cluster Buenos Park de Latinos HOEK murah,Bumi Serpong Damai Tangerang Selatan,3,85,60,1450000000,Banten
Furnished Rumah 3 Lantai Cluster Vasya Tanakayu BSD City,Bumi Serpong Damai Tangerang Selatan,3,137,84,2933835625,Banten
Jual Rumah 2 Lantai Cluster Luxmore Greenwich Park BSD City,Bumi Serpong Damai Tangerang Selatan,3,133,112,3100000000,Banten
Jual Cepat Rumah 2 lantai Cluster Anantha Avani BSD City,Bumi Serpong Damai Tangerang Selatan,3,140,160,3150000000,Banten
Jual Rumah 2 Lantai Cluster Ruby PHG Gading Serpong,Gading Serpong Tangerang,3,135,144,3000000000,Banten
RUMAH TUSUK SATE JUAL MURAH BARU RENOV AZALEA VILLAGE GADING SERPONG,Gading Serpong Tangerang,3,100,119,1650000000,Banten
Jual Rumah 2 Lantai Cluster Dakota Suvarna Sutera By Alam Sutera,Cikupa Tangerang,3,126,105,1700000000,Banten
Jual Cepat Rumah Siap Huni Cluster Flamingo The Springs Gading Serpong,Cihuni Tangerang,3,150,144,3450000000,Banten
RUMAH HUK SIAP HUNI FLAMINGGO GADING SERPONG THE SPRINGS BRAND NEW,Gading Serpong Tangerang,3,115,179,3600000000,Banten
RUMAH FLAMINGGO THE SPRINGS SUMMARECON GADING SERPONG NEGO POOL,Gading Serpong Tangerang,4,140,128,3450000000,Banten
Jual Cepat Furnished Rumah 2 Lantai Cluster Flamingo Gading Serpong,Gading Serpong Tangerang,4,130,128,3450000000,Banten
Rumah Greenwich Park Cluster Whitsand Lebar 8 Jual Cepat BSD CIty,Gading Serpong Tangerang,3,130,160,3650000000,Banten
Full Interior Rumah 2 Lantai Cluster Vivaldi Gading Serpong,Gading Serpong Tangerang,3,132,128,3500000000,Banten
RUMAH COMPACT MARTINEZ GADING SERPONG FULL FURNISHED,Gading Serpong Tangerang,3,60,52,1550000000,Banten
Tanpa DP rumah Estetik 2 Lantai Cluster Nerin Giantara Serpong,Cisauk Tangerang,3,89,72,1309377680,Banten
Jual Cepat Rumah 2 Lantai Cluster Karelia Village Gading Serpong,Gading Serpong Tangerang,3,84,72,1700000000,Banten
Jual Rumah di Bukit Nusa Indah Strategis 7 Menit ke Stasiun J 18028,Bintaro Tangerang Selatan,3,73,136,1390000000,Banten
Rumah Strategis Bisa KPR Dekat Stasiun Rawa Buntu Harga Nego J 16047,Serpong Tangerang Selatan,3,72,112,1750000000,Banten
,Jatisampurna Bekasi,3,92,99,1340000000,Jawa Barat
Rumah Dijual di Serpong Natura City Cluster Cattleya Harga Nego J 7235,Gunung Sindur Bogor,2,39,112,1380000000,Jawa Barat
Jual Rumah di Kota Harapan Indah Strategis Dekat Mall Bisa KPR J 19967,Cakung Jakarta Timur,3,150,88,1580000000,DKI Jakarta
Rumah Strategis Harga All In KPR di Villa Melati Mas Siap Huni J 18471,Serpong Utara Tangerang Selatan,2,103,140,1990000000,Banten
Rumah Minimalis bebas banjir di Taman Jatisari Permai Bekasi J 11600,Jatiasih Bekasi,2,65,112,700000000,Jawa Barat
Rumah Minimalis Strategis di Vila Gading Baru Bekasi Siap KPR J 19571,Babelan Bekasi,3,130,72,650000000,Jawa Barat
Rumah Siap Huni Strategis 15 menit ke Pasar Babelan Siap KPR J 19684,Babelan Bekasi,2,42,84,610000000,Jawa Barat
B U Rumah di Jual Cileungsi dalam Perumahan,Cileungsi Bogor,2,50,130,860000000,Jawa Barat
Rumah Strategis dekat Lippo Mall Cimanggis Square bisa KPR J 18137,Cimanggis Depok,3,100,185,1290000000,Jawa Barat
Rumah Minimalis Seken Villa Gading 1 Harapan 1 Bekasi Siap KPR J 20098,Babelan Bekasi,2,45,72,590000000,Jawa Barat
rumah lokasi strategis shm 2 lantai di jakarta pusat di cempaka putih,Cempaka Putih Jakarta Pusat,3,94,53,2400000000,DKI Jakarta
Rumah Strategis 7 menit ke Stasiun Sudimara Harga All In KPR J 18028,Ciputat Tangerang Selatan,3,73,136,1390000000,Banten
Cluster Margata Tipe Tiffany Badan Cimanggis Golf Estate,Tapos Depok,3,128,117,2849000000,Jawa Barat
Cluster Nahara Tipe 7 Cimanggis Golf Estate,Tapos Depok,3,128,119,2695400000,Jawa Barat
Dijual rumah siap huni di Sarua View Residence harga nego J 11459,Ciputat Tangerang Selatan,2,60,94,1050000000,Banten
Rumah Minimalis Siap Huni di Cluster Royal Karawaci Harga Nego J 15509,Curug Tangerang,2,39,72,740000000,Banten
D jual rumah d taman palem lestari jak bar,Cengkareng Jakarta Barat,3,120,90,2000000000,DKI Jakarta
Rumah Minimalis Seken di U House Tangerang Selatan Bisa KPR J 16671,Ciputat Tangerang Selatan,2,44,120,1980000000,Banten
Dijual Rumah di Wisteria Cakung Jakarta Timur,Cakung Jakarta Timur,3,79,84,2500000000,DKI Jakarta
Rumah Paling Murah,Gedung Johor Medan,3,140,105,690000000,Unknown
Termurah Fleekhauz Bsd Like New Semi Furnished Rapi Blm Dihuni,Tangerang Tangerang,2,48,40,950000000,Banten
Dijual Perumahan Griya Pesona Ciledug Tempat Impian Menjadi Kenyataan,Pondok Aren Tangerang,2,45,70,950000000,Banten
Dijual Rumah Anila House Vanya Park BSD Serpong Tangerang,Gading Serpong Tangerang,3,72,77,1750000000,Banten
RUMAH READY STOCK HOEK,Sarua Indah Tangerang Selatan,3,100,87,1675000000,Banten
Rumah Cantik Harga Murah di Taman Solo Cempaka Putih Jakarta Pusat,Cempaka Putih Jakarta Pusat,3,77,39,1360000000,DKI Jakarta
Rumah Baru Harga Terjangkau dekat Kampus UNJ Jakarta Timur,Rawamangun Jakarta Timur,3,67,48,1329000000,DKI Jakarta
RUMAH TOWNHOUSE DEKAT KAMPUS UI,Depok Depok,3,75,92,1300000000,Jawa Barat
Dijual rumah murah mewah SHM di jakarta timur Pulo gadung,Pulo Gadung Jakarta Timur,3,68,44,965000000,DKI Jakarta
Rumah Sejuk dan Cantik di Ciomas akses stasiun dan tol siap huni,Ciomas Bogor,3,70,96,550000000,Jawa Barat
Dijual Rumah di Bukit Dago Cluster Ambasado Bogor Jawa Barat,Gunung Sindur Bogor,3,100,114,1100000000,Jawa Barat
Rumah design Minimalist modern HARVEST BINTARO RESIDENCE,Bintaro Tangerang Selatan,3,80,109,1877000000,Banten
Di jual rumah di daerah kota bekasi bisa di cicil bebas banjir,Jatiasih Bekasi,3,90,123,1200000000,Jawa Barat
Dijual villa modern minimalis dekat gwk di Ungasan,Ungasan Badung,3,187,140,2800000000,Bali
Dijual Rumah Baru Dalam Cluster di Jatimakmur,Jatimakmur Bekasi,3,80,67,925000000,Jawa Barat
rumah baru pemuda resident,Rawamangun Jakarta Timur,3,67,48,1477000000,DKI Jakarta
Rumah Lokasi di Bekasi dan Sekitarnya Tambun Babelan Cibitung,Summarecon Bekasi Bekasi,2,45,60,420000000,Jawa Barat
DIJUAL RUMAH MURAH STRATEGIS DEPOK,Sawangan Depok,2,45,84,700000000,Jawa Barat
Rumah Mewah Harga Murah di Karang Pola Jati Padang Jakarta Selatan,Jati Padang Jakarta Selatan,4,166,84,2400000000,DKI Jakarta
DIJUAL CEPAT RUMAH Semi Furnished DEKAT TOLL ANDARA DI CIGANJUR JAG,Ciganjur Jakarta Selatan,3,120,86,1500000000,DKI Jakarta
Rumah Bebas Banjir di Taman Harapan Baru Harga Nego Siap KPR J 20509,Cakung Jakarta Timur,2,40,60,560000000,DKI Jakarta
Rumah Minimalis di Fleekhauz R Tangerang bisa KPR bebas banjir J 17344,Gading Serpong Tangerang,2,45,48,1300000000,Banten
Rumah Strategis siap huni di Bukit Nusa Indah Siap KPR dan Nego J 6439,Ciputat Tangerang Selatan,3,99,127,1480000000,Banten
Rumah Strategis Harga Nego 9 menit ke Gerbang Tol Pondok Aren J 15726,Bintaro Tangerang Selatan,3,120,165,2354000000,Banten
Dijual Cepat Rumah Tinggal Lokasi Staregis dekat Stasiun Kranji,Kranji Bekasi,2,84,85,350000000,Jawa Barat
Rumah mewah dekat tb simatupang bisa cicil 75x tanpa bunga,Fatmawati Jakarta Selatan,3,110,105,1100000000,DKI Jakarta
Dijual Rumah American style,Pondok Aren Tangerang,4,160,72,1550000000,Banten
E Lagoon Tipe Scandinavian Emerald,Ciputat Tangerang Selatan,3,74,69,1205000000,Banten
Darmawangsa Residence Cluster Singosari Tipe Kresna 70 84,Tambun Utara Bekasi,3,70,84,1088949000,Jawa Barat
Darmawangsa Residence Cluster Singosari Tipe Salvia,Tambun Utara Bekasi,2,39,72,682815000,Jawa Barat
Rumah KPR PRIBADI Belakang Stasiun Depok Lama,Ratujaya Depok,2,40,60,150000000,Jawa Barat
TURUN HARGA Dijual rumah di komplek Villa Pamulang Mas,Pamulang Tangerang Selatan,3,155,128,1675000000,Banten
Rumah Lebar 7 Nyaman Lokasi TERSTRATEGIS di BSD Dekat GS Greenwich,Lengkong Kulon Tangerang,3,70,77,1650000000,Banten
RUMAH DIJUAL MURAH DI JATILUHUR AKSES 2 MOBIL DI CLUSTER TOL JATIWARNA,Pondok Gede Bekasi,2,50,83,693000000,Jawa Barat
villa siap huni furnished 600mtr dari karma beach,Ungasan Badung,2,130,140,2850000000,Bali
Rumah baru di jual di Pondok Kelapa Jakarta Timur,Pondok Kelapa Jakarta Timur,3,150,90,2600000000,DKI Jakarta
Dijual rumah Panasonic Homes OCBD Pine Residence,Cibuluh Bogor,3,82,84,1800000000,Jawa Barat
Rumah 800 jt an dekat pintu toll di tanah baru beji,Tanah Baru Depok,3,61,66,874000000,Jawa Barat
DIjual Rumah bebas banjir di Griya Ahmad Dahlan Depok bisa KPR J 19738,Beji Depok,2,110,136,1420000000,Jawa Barat
Rumah Asri Minimalis Dijual di Sentul City Harga All In KPR J 17780,Sentul Bogor,2,50,72,700000000,Jawa Barat
Grand Batavia 2 Cluster Sirena Tipe Althea,Pasar Kemis Tangerang,2,45,60,553699580,Banten
Cluster Bellwood Tipe 157 162,Gunung Putri Bogor,3,157,162,2689627000,Jawa Barat
Cluster Miami Tipe 8,Gunung Putri Bogor,3,128,112,2074667000,Jawa Barat
Rumah 2 Lantai Plus rooftop suasana nyaman se Jakarta timur,Ciracas Jakarta Timur,2,70,40,850000000,DKI Jakarta
Nano Town 4 Tipe Newton,Pamulang Tangerang Selatan,2,52,75,1089000000,Banten
Grand Duta City Cluster Pasadena Tipe 39 Canyon,Babelan Bekasi,2,39,60,859395994,Jawa Barat
Tamaruma Sawangan Tipe 85,Bojongsari Depok,3,85,84,1069606773,Jawa Barat
Mutiara Gading City Tipe Musse,Tarumajaya Bekasi,3,39,95,765000000,Jawa Barat
Grand Duta City West Manhattan Tipe Sherman,Babelan Bekasi,3,88,105,1514784324,Jawa Barat
Grand Residence City Bekasi Cluster Neo Dharmawangsa Tipe 54,Setu Bekasi,3,54,60,836805000,Jawa Barat
Kebayoran Piazza Tipe Azzola,Pondok Aren Tangerang,3,143,97,3474000000,Banten
Bukit Golf Riverside Cluster Lagoon Park Tipe Carnia,Gunung Putri Bogor,4,69,60,1134682139,Jawa Barat
Kana Park Cluster Kano Tipe 39,Legok Tangerang,2,39,60,596780000,Banten
Cluster Nashville Tipe 137,Gunung Putri Bogor,3,137,128,2184446000,Jawa Barat
Cluster Bhumi Anvaya Minimalist House Tipe Aruna Prime,Babakan Madang Bogor,3,70,60,1165000000,Jawa Barat
Cluster Bhumi Anvaya Villa House Tipe Agra Deluxe,Babakan Madang Bogor,3,70,120,1982000000,Jawa Barat
Cluster Bhumi Svarga Tipe Kayana,Babakan Madang Bogor,2,36,72,1170000000,Jawa Barat
Cluster Bhumi Anvaya Minimalist House Tipe Aruna Deluxe,Babakan Madang Bogor,2,50,60,1498000000,Jawa Barat
Tanakayu Vasya BSD City Tipe 7,Pagedangan Tangerang,3,137,84,3352955000,Banten
Bukit Podomoro Jakarta Tipe 6,Duren Sawit Jakarta Timur,3,146,90,4000000000,DKI Jakarta
Bukit Podomoro Jakarta Tipe 6 Wales,Duren Sawit Jakarta Timur,3,123,90,3600000000,DKI Jakarta
Graha Taruma Tipe Saga,Cirendeu Tangerang Selatan,2,105,74,1931721850,Banten
Kebayoran Piazza Tipe Pinnata,Pondok Aren Tangerang,2,73,67,2181000000,Banten
Summarecon Crown Gading Cluster Jasmia tipe 10 x 15,Setia Asih Bekasi,3,165,150,3025860000,Jawa Barat
Sentul City Spring Valley Tipe C 6x13 5,Babakan Madang Bogor,2,50,81,933399000,Jawa Barat
Sentul City Spring Valley Tipe A 5 5x12,Babakan Madang Bogor,2,34,110,1028759100,Jawa Barat
Golden Gemilang Bekasi Tipe Tulip,Cibitung Bekasi,2,31,50,432976550,Jawa Barat
Sierra Azalea Tipe L7,Pamulang Tangerang Selatan,3,116,98,1987500000,Banten
Kota Harapan Indah Asera Nishi Tipe N7,Medan Satria Bekasi,3,85,84,2097000000,Jawa Barat
Winston Residence Tipe Wendelin,Cisauk Tangerang,4,100,100,1680000000,Banten
Winston Residence Tipe Witney,Cisauk Tangerang,2,50,50,1020000000,Banten
Golden Park 2 Tipe Mahogany,Cisauk Tangerang,3,88,94,1549850000,Banten
Bukit Golf Riverside Cluster Lagoon Park Tipe Corsica,Gunung Putri Bogor,3,160,135,3215903200,Jawa Barat
Bukit Golf Riverside Cluster Lagoon Park Tipe Tetiara,Gunung Putri Bogor,4,96,119,2341254160,Jawa Barat
Emerald City Tipe Shinju,Cibinong Bogor,2,38,72,644800000,Jawa Barat
Cluster Bhumi Svarga Tipe Asana,Babakan Madang Bogor,2,45,72,1380000000,Jawa Barat
Bali Resort Tangerang Tipe Bali Suite Hook,Sepatan Tangerang,3,108,88,1260700000,Banten
Inkamaya Tipe 36,Ciampea Bogor,2,39,72,487775330,Jawa Barat
Metland Cibitung Cluster Barcelona Cove Tipe 56 84,Bekasi,3,56,84,944382353,Jawa Barat
Sinar Mitbana Mas Hiera Tipe 7,Pagedangan Tangerang,3,118,98,2800000000,Banten
Golden City Cluster Diamond Tipe Jade Plus Hoek,Teluk Pucung Bekasi,3,69,88,1225639800,Jawa Barat
Summarecon Crown Gading Cluster Jasmia tipe 9 x 15,Setia Asih Bekasi,3,149,135,2713950000,Jawa Barat
Cluster Victoria Green Residence Tipe Milan,Setia Mulya Bekasi,2,52,72,1100500000,Jawa Barat
Aquila Valley Tipe Cendrawasih,Ciseeng Bogor,2,32,60,328000000,Jawa Barat
Maison de Wisteria Tipe B,Cakung Jakarta Timur,3,103,84,1900000000,DKI Jakarta
Daru Metropolis Cluster Illinois Tipe 27 72,Jambe Tangerang,2,27,72,264894000,Banten
Graha Raya Cluster Fortune Garden Tipe Lantana,Ciledug Tangerang,3,67,60,1385100000,Banten
Puri Canary Tipe Crested,Pasar Kemis Tangerang,2,31,60,419933357,Banten
Mustika Village Sukamulya Tipe Ginza,Cikarang Bekasi,2,60,30,224000000,Jawa Barat
Serpong Green Paradise Tipe Orchid 1 Lantai,Parung Panjang Bogor,2,42,84,481500000,Jawa Barat
Panjibuwono City Cluster Casablanca Tipe Casa Jardin,Babelan Bekasi,2,39,72,734452000,Jawa Barat
Springhill Yume Lagoon Tipe Ajisai,Cisauk Tangerang,2,36,60,707403000,Banten
Darmawangsa Residence Cluster Sriwijaya Waterfront Tipe Astha Grande,Bekasi,3,60,84,1023957000,Jawa Barat
Springhill Yume Lagoon Tipe Himawari,Cisauk Tangerang,3,104,112,1726272000,Banten
Panjibuwono City Cluster Casablanca Tipe Casa Familia,Babelan Bekasi,3,55,72,947230000,Jawa Barat
Bukit Golf Riverside Cluster Orchid Tipe Guarana,Gunung Putri Bogor,3,43,90,1141729489,Jawa Barat
Yamala Haus Tipe BH,Serpong Tangerang Selatan,3,68,73,1420000000,Banten
Synthesis Homes Tipe Paras Hook,Ciputat Tangerang Selatan,3,73,86,2266620000,Banten
Grand Duta City South of Jakarta Tipe Florence,Parung Bogor,3,74,60,936878250,Jawa Barat
Sapta Villa Tipe Lark 75 84,Cibinong Bogor,3,75,84,1119302163,Jawa Barat
Lavesh Phase 2 Kota Harapan Indah Tipe Arvinza Standar 57 75,Tarumajaya Bekasi,3,57,75,1462000000,Jawa Barat
Summarecon Crown Gading Cluster Regia tipe 6 x 11,Setia Asih Bekasi,2,63,66,1169940000,Jawa Barat
Cluster Victoria Green Residence Tipe Roma,Setia Mulya Bekasi,3,70,96,1442500000,Jawa Barat
Grand Safira Tipe 56,Cengkeh Turi Binjai,2,56,105,350000000,Unknown
Cluster Nashville Tipe 129,Gunung Putri Bogor,3,129,112,1979724000,Jawa Barat
Golden Park 2 Tipe Cedar,Cisauk Tangerang,2,65,142,1812556780,Banten
Cluster Victoria Village Tipe River,Setia Mulya Bekasi,2,27,60,357818182,Jawa Barat
Naira Residence 2 Lake View Tipe Como A,Cisauk Tangerang,3,60,70,1080000000,Banten
Grand Harmoni 5 Tenjo Tipe 44 60,Tenjo Bogor,3,60,44,280000000,Jawa Barat
Cluster Victoria Asri Tipe Anthurium,Setia Mulya Bekasi,2,30,60,360000000,Jawa Barat
Vasaka City Tipe 29 60,Sukawangi Bekasi,2,29,60,326000000,Jawa Barat
Aspen Park Tipe 6 x 10 Premium,Serpong Tangerang Selatan,3,60,77,1251000000,Banten
Cluster Dakota Tipe Datura at Suvarna Sutera,Cikupa Tangerang,3,126,105,1787100000,Banten
Grand Wisata Water Terrace II Flawless Living Tipe Lagoon 143,Tambun Selatan Bekasi,4,143,160,3341546390,Jawa Barat
Kota Podomoro Tenjo Cluster Kaliandra Tipe 36,Tenjo Bogor,2,36,72,352972973,Jawa Barat
Kota Podomoro Tenjo Cluster Magnolia Tipe 36,Tenjo Bogor,2,36,90,357846000,Jawa Barat
Premier Promenade Tipe Tulip,Pancoran Mas Depok,4,124,134,2788000000,Jawa Barat
Ikon Tenjo Resort Homes Tipe Calathea,Tenjo Bogor,2,32,60,336060000,Jawa Barat
Cendana Botanic Tipe Sanctuary,Bojong Nangka Tangerang,3,88,87,1419929755,Banten
Grand Surya Estate Tipe Arden,Duren Jaya Bekasi,3,87,96,1379095421,Jawa Barat
Desain Rumah Efisien Cluster Danisha at Tera Damai Tipe 52 Variabel,Medan Satria Bekasi,2,52,85,673000000,Jawa Barat
Cluster Victoria Elok Tipe Camelia,Setia Mulya Bekasi,2,45,84,508805000,Jawa Barat
Cluster Alamanda Tipe 36 Samesta Parayasa,Parung Panjang Bogor,2,36,102,491000000,Jawa Barat
Clarity House Tipe Viola 8x11,Ciputat Tangerang Selatan,3,140,88,2250000000,Banten
Synthesis Homes Tipe Flexy Home,Ciputat Tangerang Selatan,3,127,54,2712840000,Banten
Cluster New Bougenville Tipe 45 Samesta Parayasa,Parung Panjang Bogor,2,45,96,626000000,Jawa Barat
Panjibuwono City Cluster Casablanca Tipe Casa Grande,Babelan Bekasi,3,60,72,1010005000,Jawa Barat
Bumi Bantar Panjang Tipe Azalea A,Tigaraksa Tangerang,2,27,60,227000000,Banten
Kemang Verde Tipe 36 60,Bogor,1,36,60,445300000,Jawa Barat
Padma Hills Tipe 36,Gunung Sindur Bogor,2,36,72,405000000,Jawa Barat
Ruma Priva Tipe 103,Tangerang Selatan,3,103,99,1805000000,Banten
Bali Resort Bogor Uluwatu Ext Tipe 56,Ranca Bungur Bogor,3,56,60,528905000,Jawa Barat
Sinar Mitbana Mas Hiera Tipe 8,Pagedangan Tangerang,4,166,128,3900000000,Banten
Graha Tirta Asri Tipe Lotus,Ciseeng Bogor,2,45,91,760000000,Jawa Barat
PIK 2 Villa Pasir Putih 5 Tipe 6x15,Dadap Tangerang,3,130,90,3695000000,Banten
Cluster Danisha at Tera Damai Tipe 40 Sudut,Medan Satria Bekasi,2,40,80,713000000,Jawa Barat
Daru Metropolis Cluster Helsinki Tipe 22 72,Jambe Tangerang,2,22,72,271296383,Banten
Wellspring House Tipe Blooming,Serpong Tangerang Selatan,3,110,72,1470000000,Banten
De LORA Tipe 48,Parung Panjang Bogor,3,48,72,716530000,Jawa Barat
Cluster Nahara Tipe 9 Cimanggis Golf Estate,Tapos Depok,3,165,153,3453200000,Jawa Barat
Cluster Margata Tipe Pine Badan Cimanggis Golf Estate,Tapos Depok,3,91,96,2198000000,Jawa Barat
Cluster UENOS HOUSE Tipe N Cimanggis Golf Estate,Tapos Depok,2,56,64,990000000,Jawa Barat
Cluster Nahara Tipe 5 Cimanggis Golf Estate,Tapos Depok,2,89,85,1912000000,Jawa Barat
Darmawangsa Residence Cluster Sriwijaya Tipe Pandawa,Tambun Utara Bekasi,2,59,78,1006666000,Jawa Barat
Bukit Golf Riverside Cluster Lagoon Park Tipe Caviana,Gunung Putri Bogor,4,86,72,1540664183,Jawa Barat
Golden Park 2 Tipe Viola,Cisauk Tangerang,2,45,35,690668790,Banten
Cluster Nashville Tipe 142,Gunung Putri Bogor,3,142,112,2091566000,Jawa Barat
Mustika Village Sukamulya Tipe Ueno,Cikarang Bekasi,2,60,25,173500000,Jawa Barat
Paramount Land Fresco Cluster Arcadia Village Tipe L6,Gading Serpong Tangerang,2,63,48,1239600000,Banten
Dijual Ruko lokasi strategis Tanah Tinggi di Jakarta Pusat,Tanah Tinggi Jakarta Pusat,2,72,68,1404000000,DKI Jakarta
Rumah baru mewah harga murah minimalis,Matraman Jakarta Timur,2,58,30,796620000,DKI Jakarta
Grand Duta City South of Jakarta Tipe Alexandra,Parung Bogor,3,88,105,1506385440,Jawa Barat
Citaville Cibubur Tipe Calgary 2 Kamar,Cileungsi Bogor,2,63,60,783021000,Jawa Barat
Rumah 2 Lantai Plus Rooftop di Lantai 3,Pondok Ranggon Jakarta Timur,2,70,32,400000000,DKI Jakarta
Rumah Modern Minimalis 1 lantai di Surabaya Barat,Benowo Surabaya,2,43,70,760450000,Jawa Timur
DIJUAL RUMAH 2 LANTAI MEWAH DEKAT TOL CIBUBUR KPR CICILAN FLAT,Condet Jakarta Timur,3,74,60,800000000,DKI Jakarta
Rumah Mewah 2 Lantai Terjangkau di Cilangkap,Cilangkap Jakarta Timur,3,72,58,800000000,DKI Jakarta
Dijual cepat murah rumah dekat kampus atmajaya nittaya avani bsd,Bumi Serpong Damai Tangerang Selatan,3,110,144,2650000000,Banten
Rumah 2 Lantai Mewah Lokasi Jakarta Harga Terjangkau,Depok,3,80,69,800000000,Jawa Barat
Termurah B Rumah Greenlake Citraland 2 Lantai Semi Furnish,Citraland Surabaya,4,180,135,2400000000,Jawa Timur
Rumah Minimalis Modern di Green Park Cluster Pinewood Siap KPR J 18061,Pondok Melati Bekasi,3,160,105,1820000000,Jawa Barat
Rumah Brand New Lokasi BSD Pusat Sebelah AEON 1 Menit dr Tol Freja,Pagedangan Tangerang,4,118,104,3500000000,Banten
Rumah Cantik 2 Lantai Siap Huni Strategis Ke Lippo Karawaci GS,Curug Tangerang,3,83,72,1080000000,Banten
Rumah Furnish Sudah Renov Tanah Luas Lokasi di BSD dkt Tol,Serpong Tangerang Selatan,2,50,84,1290000000,Banten
Rumah Minimalis di Perumahan Citra Maja 2 Pecatu,Maja Lebak,1,32,98,265000000,Banten
Rumah Dekat Tol Andara Sawangan Cinere Limo,Rangkapan Jaya Depok,2,40,107,825000000,Jawa Barat
Rumah 1 Lantai Araya Malang,Pakis Malang,2,36,70,800000000,DI Yogyakarta
Cluster Emory Tipe Akasia Eka Parkland Podomoro Karawang,Karawang Barat Karawang,2,82,78,1420000000,Jawa Barat
Citra Grand Cibubur CBD Cluster Farser Park Tipe L7,Jatisampurna Bekasi,3,86,84,1544575000,Jawa Barat
Citra Grand Cibubur CBD Cluster Lagoon Residence Tipe L8,Jatisampurna Bekasi,3,112,120,2132627000,Jawa Barat
Rumah Murah Angsuran Rendah Tanpa DP,Depok Depok,3,100,78,1250000000,Jawa Barat
Citra Grand Cibubur CBD Cluster Lagoon Residence Tipe L10,Jatisampurna Bekasi,4,185,180,3336506000,Jawa Barat
Adhi City Sentul Tipe Aruna Standard,Sentul Bogor,1,40,60,850000000,Jawa Barat
Adhi City Sentul Tipe Agra Standard,Sentul Bogor,2,60,90,1283000000,Jawa Barat
Cluster The Northbend Tipe 6x12 Metland Cyber City,Karang Tengah Tangerang,3,72,72,1799226000,Banten
Cluster Ridge Crystal Tipe 52 72 Harvest City,Cileungsi Bogor,2,52,72,700000000,Jawa Barat
Taman Jatisari Permai Tipe 54,Jatiasih Bekasi,2,54,64,1137520000,Jawa Barat
