Judul,Alamat,Kamar Tidur,Luas Bangunan,Luas Lahan,Harga,Provinsi
Dijual Rumah Strategis bebas banjir di Felicia Residence Bogor J 14149,Gunung Sindur Bogor,1,45,60,590000000,Jawa Barat
Rumah Strategis Dijual di Perumahan Pondok Maharta Harga Nego J 19247,Bumi Serpong Damai Tangerang Selatan,1,90,60,380000000,Banten
Rumah Siap Huni Harga Nego di Graha Raya Melati Loka Bisa KPR J 16113,Serpong Utara Tangerang Selatan,2,54,90,1475000000,Banten
Dijual Rumah Asri Strategis di Legenda Wisata Bogor Harga Nego J 16307,Cibubur Jakarta Timur,4,105,136,1780000000,DKI Jakarta
DIJUAL RUMAH MURAH BANGET 15 MENIT ME STASIUN CISAUK J 15969,Bumi Serpong Damai Tangerang Selatan,2,60,72,450000000,Banten
Rumah di Grand Bintaro Asri Strategis Dekat Mega Mall Ciputat J 16533,Bintaro Tangerang Selatan,2,65,66,1020000000,Banten
Dijual rumah seken minimalis di Bizhome Cikupa siap KPR J 4044,Cikupa Tangerang,2,36,64,430000000,Banten
Jual Rumah Minimalis Dekat Gerbang Tol BSD Barat 1 Harga Nego J 16114,Bumi Serpong Damai Tangerang Selatan,2,41,72,960000000,Banten
Rumah Baru Murah Dua Lantai di Dekat Suhat,Lowokwaru Malang,3,80,72,880000000,Jawa Timur
Dijual rumah mewah di cempaka putih tengah Jakarta Pusa,Cempaka Putih Jakarta Pusat,2,86,51,2028300000,DKI Jakarta
Rumah Cantik Murah Meriah jln keadilan 5 ITC Glodok Jakarta barat,Taman Sari Jakarta Barat,2,44,28,526516500,DKI Jakarta
Rumah baru mewah murah modernt,Cempaka Putih Jakarta Pusat,3,94,53,2400000000,DKI Jakarta
READY Tanpa DP Tanpa BI checking Stock Terbatas,Serpong Tangerang Selatan,2,27,60,280025700,Banten
dijual rumah janur asri Kelapa gading brand new renovasi,Kelapa Gading Jakarta Utara,4,180,102,3300000000,DKI Jakarta
Rumah Minimalis Modern Full Renov Di Girya Loka Bsd Serpong Kpr,Serpong Tangerang Selatan,2,80,90,1500000000,Banten
THE ANDALUS RESIDENCE RUMAH HARGA MURAH DI BOGOR,Tanah Sareal Bogor,2,49,90,400000000,Jawa Barat
PROMO JANUARI 250 JUTA DAPAT RUMAH DI JOGJA DEKAT EXIT TOL SENTOLO,Wirobrajan Yogyakarta,2,36,70,250000000,DI Yogyakarta
dijual cepatClluster Purimas filla cinangka,Cinangka Depok,2,80,185,1200000000,Jawa Barat
Rumah minimalis 2 lantai strategis dan Murah,Karawaci Tangerang,2,55,60,875000000,Banten
Rumah 1 lantai dekat Pemda Cibinong cukup 3 juta ALL IN,Cibinong Bogor,2,36,73,599450000,Jawa Barat
Cluster Dp10jt All in Cicilan 2jtan SHM Full Bata Merah,Jatiasih Bekasi,2,45,70,502000000,Jawa Barat
Rumah Baru Minimalis 3 Lantai Di Summarecon Pusat Kota Gading Serpong,Serpong Tangerang Selatan,3,144,84,2800000000,Banten
Rumah Strategis dekat dengan Cibinong City Mall 2 Bisa KPR J 19089,Cibinong Bogor,2,64,64,590000000,Jawa Barat
Jual Rumah di Vida Bekasi Strategis Harga All In Bebas Banjir J 14475,Jatiasih Bekasi,2,50,60,1100000000,Jawa Barat
Rumah Strategis di Bekasi Dekat Rumah Sakit Permata Siap KPR J 15927,Tambun Selatan Bekasi,3,95,128,757000000,Jawa Barat
Dijual rumah di Citra 5 Bebas banjir bisa KPR lokasi strategis J 17988,Kalideres Jakarta Barat,2,96,128,2120000000,DKI Jakarta
Rumah 2 Lantai di Diamond Andara Residence Bebas Banjir KPR J 19343,Cinere Depok,2,72,102,1610000000,Jawa Barat
Rumah Strategis hanya 10 menit ke Terminal Sawangan Bisa KPR J 19253,Sawangan Depok,3,110,134,1180000000,Jawa Barat
Jual Rumah Strategis 10 menit ke Terminal Sawangan Harga Nego J 18865,Sawangan Depok,3,76,96,820000000,Jawa Barat
Rumah Luas di Kota Wisata Vancouver Harga All In KPR Bisa Nego J 16153,Cileungsi Bogor,3,105,128,1900000000,Jawa Barat
Dijual Rumah Minimalis di Serpong Natura City Bogor Siap KPR J 18953,Gunung Sindur Bogor,2,45,81,650000000,Jawa Barat
Rumah Spek Premium Bonus Voucher Belanja IKEA di Sawangan Depok,Cinere Depok,2,36,50,374000000,Jawa Barat
Rumah tanah kawasan sejuk cigadung dekat dago,Dago Bandung,3,78,120,1749000000,Jawa Barat
Rumah 2 Lantai Siap Huni di Kota Wisata Bogor Harga Nego J 15559,Gunung Putri Bogor,2,107,128,1770000000,Jawa Barat
Rumah Strategis hanya 10 menit ke Mall Green Sedayu bisa KPR J 17644,Kalideres Jakarta Barat,3,116,90,2570000000,DKI Jakarta
Rumah di Serpong Garden Dekat Tol BSD Barat 1 Harga All In KPR J 16125,Cisauk Tangerang,3,88,78,1350000000,Banten
Dijual Rumah di Cisauk Hanya 9 Menit Ke Stasiun Harga All In J 16114,Cisauk Tangerang,2,41,72,960000000,Banten
Dijual Rumah Strategis hanya 3 menit ke Pasar Cikunir Bisa KPR J 16322,Jatiasih Bekasi,3,54,72,750000000,Jawa Barat
Dijual rumah seken 2 lantai di Griya Cibubur Asri siap KPR J 16193,Cimanggis Depok,3,60,93,750000000,Jawa Barat
Jual Rumah Siap Huni Dekat Stasiun Di Jalan Taman Asri J 15832,Bintaro Tangerang Selatan,4,180,120,1770000000,Banten
Dijual Murah Rumah Usaha di Jalan Poros Merjosari Malang,Merjosari Malang,3,125,150,1200000000,Jawa Timur
SPECIAL PROMO Rumah Jogja Murah 200 Jutaan 20 Menit ke Kota,Sentolo Kulon Progo,2,36,70,250000000,DI Yogyakarta
Dijual Villa Komplek Krakatau Point Tahap 2 Jalan Sukamurni,Medan Kota Medan,3,54,84,1100000000,Unknown
Rumah jogja 200 jutaan dalam cluster wates km 14,Sentolo Kulon Progo,2,3,71,249999999,DI Yogyakarta
Rumah Cluster Cuma 250 Juta di Jogja Barat 1 Kilo Tol Sentolo,Sentolo Kulon Progo,2,36,71,250000000,DI Yogyakarta
Jual Rugi Rumah Bagus Alicante Tipe 10x18 di Pusat Gading Serpong,Serpong Tangerang Selatan,3,162,180,3500000000,Banten
Rumah Baru 2 LANTAI Dekat Pamulang Townhouse Pondok Petir Kota Depok,Pamulang Tangerang Selatan,3,70,65,725000000,Banten
Rumah Murah Yogyakarta 1 8 Milyaran Fully Furnished,Kalasan Sleman,3,122,115,1870000000,DI Yogyakarta
Rumah Mewah dekat ke AEON Mall dan Toll BSD 10 juta langsung akad,Pasar Minggu Jakarta Selatan,3,98,140,1819370000,DKI Jakarta
Rumah dijual Bandung type 60 90 Soreang Bandung,Soreang Bandung,3,60,90,420000000,Jawa Barat
Jual Cepat Rumah 2 Lantai cluster chrysocolla PHG Gading Serpong,Gading Serpong Tangerang,3,120,126,2600000000,Banten
Rumah Pondok Asri Pantai Kedungu Nyitdah Tabanan,Nyitdah Tabanan,3,60,100,550000000,Bali
Dijual Rumah Hanya Selangkah Ke Pasar Mini Depok Harga All In J 15938,Sukmajaya Depok,2,45,98,1160000000,Jawa Barat
Rumah Strategis 2 Lantai Dekat Stasiun Bekasi di Duta Graha J 18064,Harapan Indah Bekasi,3,122,90,1490000000,Jawa Barat
Rumah Siap Huni Strategis Dekat Terminal Bsd Harga Nego J 16021,Bumi Serpong Damai Tangerang Selatan,3,78,117,1790000000,Banten
Jual Rumah Strategis di Jalan Haji Baping harga Nego Bisa KPR J 19219,Ciracas Jakarta Timur,2,70,129,1270000000,DKI Jakarta
Rumah baru dan mewah strategis akses 2 mobil di Cempaka putih,Cempaka Putih Jakarta Pusat,3,94,53,2400000000,DKI Jakarta
Dijual Rumah Baru The Green Orchard Timur Full Keramik Pontianak Kota,Pontianak Kota Pontianak,2,75,184,1150000000,Unknown
Jual Rumah Siap Huni 10 Menit ke Stasiun Rawa Buntu Bisa KPR J 16005,Serpong Tangerang Selatan,2,50,84,1420000000,Banten
Jual Rumah Bsd Serpong Perumahan Islami Desain Bebas Pilih sendiri,Bumi Serpong Damai Tangerang Selatan,3,60,60,1407000000,Banten
Rumah 3 Lantai L8 Citra Garden Serpong dekat mall AEON BSD Tol Jorr,Bumi Serpong Damai Tangerang Selatan,4,141,120,2970000000,Banten
Dijual Rumah 2 Lantai di Bukit Dago Bogor Siap Nego J 15709,Gunung Sindur Bogor,3,100,112,1020000000,Jawa Barat
Rumah Strategis bebas banjir dekat Lippo Mall Puri Siap KPR J 20403,Kembangan Jakarta Barat,2,120,150,3210000000,DKI Jakarta
Jual Rumah 2 Lantai Siap KPR di Bukit Cimanggu City Harga Nego J 8927,Dramaga Bogor,4,88,73,990000000,Jawa Barat
Dijual Rumah Syariah di Kota Bogor dekat Tol dan Taman Yasmin,Bogor Barat Kota Bogor,3,70,72,815000000,Jawa Barat
Rumah Dijual Dekat Eka Hospital Cibubur Harga Nego Siap KPR J 14061,Cibubur Jakarta Timur,2,54,90,1250000000,DKI Jakarta
Rumah Strategis 15 Menit ke Mall Metropolitan Bekasi Siap KPR J 12580,Tambun Selatan Bekasi,2,66,66,650000000,Jawa Barat
Rumah Baru 3 Lantai Adora BSD City dekat AEON Mall Toll JORR Stasiun,Bumi Serpong Damai Tangerang Selatan,4,84,144,2760000000,Banten
Perdana Kampus Jimbaran,Jimbaran Badung,3,70,100,1250000000,Bali
Dijual Rumah Mewah di Lokasi Strategis Cempaka Putih Timur Jakarta Pus,Cempaka Putih Jakarta Pusat,2,68,45,1400000000,DKI Jakarta
Dijual rumah siap huni di Bumi Dirgantara Permai dekat tol J 16691,Jatiasih Bekasi,3,120,120,910000000,Jawa Barat
Rumah Minimalis Strategis dekat Pasar Cileungsi Bogor Siap KPR J 18349,Pamulang Tangerang Selatan,2,90,90,1610000000,Banten
eclipse villa holidayhome jimbaran,Puri Gading Badung,2,50,100,1250000000,Bali
Rumah Strategis Dijual di Graha Raya Bintaro Jaya Harga Nego J 15438,Bintaro Tangerang Selatan,2,60,120,1730000000,Banten
Dijual rumah siap huni di Gladiola Residence bisa Proses KPR J 18189,Bintaro Tangerang Selatan,2,68,48,1040000000,Banten
Dijual rumah seken minimali di Jatisari Permai Bekasi siap kpr J 16989,Jatiasih Bekasi,2,144,60,910000000,Jawa Barat
rumah dekat terminal batubulan dengan 2 kamar,Sukawati Gianyar,2,45,63,580000000,Bali
Rumah 2 Lantai Desain Elegan Lokasi Strategis Cocok untuk Keluarga,Lowokwaru Malang,4,170,128,2550000000,Jawa Timur
RUMAH 2 LANTAI CLUSTER JL RESIMUKA MONANG MANING DENPASAR BALI,Denpasar Barat Denpasar,3,80,70,1080000000,Bali
Rumah Bsd Eminent Vivacia Bsd Serpong,Bumi Serpong Damai Tangerang Selatan,3,85,105,2350000000,Banten
Dijual murah rumah lt72 120 hrg475jt dekat jalur angkot Antapani,Antapani Bandung,2,120,72,475000000,Jawa Barat
Villa 3kamar 5 mnt ke Pantai Jimbaran Bali Summerfield Type Breeze,Jimbaran Badung,3,135,100,2950000000,Bali
Cluster Dp 5jt All in Cicilan 4jtan Dijual Sudah SHM Bekasi Kota,Jatiasih Bekasi,2,53,80,680000000,Jawa Barat
RUMAH 2LANTAI RUKO PINGGIR JL RAYA BANGET DEKAT TOL CIBUBUR DP SUKA,Kalisari Jakarta Timur,3,81,55,775000000,DKI Jakarta
Dijual rumah seken 2 lantai di Limus Pratama Regency siap KPR J 10301,Cileungsi Bogor,3,150,160,1180000000,Jawa Barat
CLUSTER RUMAH 2 LANTAI MEWAH DEKAT TOL CIBUBUR KPR CICILAN FLAT,Jagakarsa Jakarta Selatan,3,74,60,800000000,DKI Jakarta
Rumah Harga All In di Serpong Garden 2 Bebas Banjir Bisa Kpr J 12420,Bumi Serpong Damai Tangerang Selatan,2,60,84,1140000000,Banten
VILLA MODERN DEKAT SEKOLAH LENTERA KASIH AREA SEMINYAK,Denpasar Barat Denpasar,2,100,80,2000000000,Bali
Rumah Dijual di Shila At Sawangan Cluster The Grove Harga Nego J 15880,Sawangan Depok,3,109,112,2300000000,Jawa Barat
Rumah Dijual di Citra Grand Bekasi Harga All In Bebas Banjir J 17972,Cibubur Jakarta Timur,2,90,114,2240000000,DKI Jakarta
Rumah Dekat Rs Harapan Keluarga Jababeka Harga All In Siap Kpr J 15287,Cikarang Bekasi,3,70,120,1530000000,Jawa Barat
Rumah Dekat Mall di Grand View Karawaci Tangerang Harga All In J 16140,Gading Serpong Tangerang,2,50,72,810000000,Banten
Rumah di Newland Matoa Dekat Pasar Gandul Modern Harga All In J 17959,Limo Depok,3,95,84,1640000000,Jawa Barat
Rumah Dijual di Sanur Valley Serpong Minimalis Siap KPR J 16868,Serpong Tangerang Selatan,2,45,72,550000000,Banten
Perumahan TERSTRATEGIS Barat Perempatan Gedangan Sidoarjo,Gedangan Sidoarjo,2,36,78,298000000,Jawa Timur
Rumah Minimalis Harga All In di Villa Mutiara Bogor 2 Bisa KPR J 17265,Cibinong Bogor,2,60,60,510000000,Jawa Barat
Dijual rumah cluster di jalan cempaka putih tengah jakarta pusat,Cempaka Putih Jakarta Pusat,3,94,53,2400000000,DKI Jakarta
Dijual Rumah Minimalis 10 Menit ke Stasiun Cilebut Siap KPR J 15729,Tanah Sareal Bogor,2,54,78,820000000,Jawa Barat
Rumah di Serpong Garden Dekat Aeon Mall BSD Siap Huni Bisa KPR J 8538,Cisauk Tangerang,3,54,60,970000000,Banten
Rumah Murah Dalam Kompleks Ringroad,Medan Sunggal Medan,3,160,112,1650000000,Unknown
Dijual Overkredit Rumah Subsidi di Solear Tangerang Tanpa Perantara,Solear Tangerang,2,60,60,158000000,Banten
Rumah Minimalis di Metland Cibitung Cluster Taman Ancol KPR J 14380,Cibitung Bekasi,2,43,72,610000000,Jawa Barat
Rumah Strategis hanya 10 menit ke Mall Paradise Walk Serpong J 19428,Gunung Sindur Bogor,2,60,90,950000000,Jawa Barat
Rumah Siap Huni Bisa KPR Dekat Gerbang Tol BSD Bebas Banjir J 16005,Bumi Serpong Damai Tangerang Selatan,2,50,84,1320000000,Banten
Dijual Rumah Strategis 17 menit ke PIM Bebas Banjir bisa KPR J 14022,Kembangan Jakarta Barat,4,200,138,2140000000,DKI Jakarta
Dijual rumah siap huni di Jatiasih bekasi lokasi dekat Tol J 17698,Jatiasih Bekasi,3,100,150,1720000000,Jawa Barat
Rumah Mewah Terlaris di Sleman Sofia Residence Pandowoharjo,Sleman Sleman,3,120,110,980000000,DI Yogyakarta
Rumah Gentan Solo Ready Unit mewah dekat solo dan solo baru,Pajang Solo,3,109,91,885000000,Jawa Tengah
Rumah baru baru mewah jakarta pusat,Cempaka Putih Jakarta Pusat,3,77,39,1395000000,DKI Jakarta
Dijual rumah murah jogja dalam cluster di sentolo yogyakarta,Sentolo Kulon Progo,2,36,71,250000000,DI Yogyakarta
rumah murah di jalan kembar luas 148 graha dewata shm aman,Lowokwaru Malang,2,148,148,675000000,Jawa Timur
Dijual Rumah di Griyashanta Dekat Kampus Brawijaya Malang,Jatimulyo Malang,3,162,160,2400000000,Jawa Timur
HOT SALE Rumah Baru Gaya Classic American di Araya,Malang,4,150,119,1850000000,Jawa Timur
RUMAH MINIMALIS MURAH SINGOSARI 0 JALAN,Singosari Malang,2,30,60,325000000,Jawa Timur
The Nove Tipe Terrace House Nuvasa Bay,Nongsa Batam,3,94,70,1640000000,Unknown
5 juta dapat rumah 2 lantai free biaya lain lain,Jababeka Cikarang Bekasi,2,36,40,610000000,Jawa Barat
Rumah Full Furnish Di Pusat Kota BSD Dekat Aeon Mall dan Akses Toll,Bumi Serpong Damai Tangerang Selatan,4,137,84,2970000000,Banten
VILLA VIEW KEREN BATU FREE ROOFTOP DAN KOLAM RENANG,Oro oro Ombo Batu,3,86,72,790000000,Jawa Timur
Rumah 2 Lantai Strategis Dekat Stasiun Cilebut Siap Kpr J 15043,Tanah Sareal Bogor,3,106,150,1380000000,Jawa Barat
Rumah Minimalis 2 Lantai di Park Residence Kalideres Siap KPR J 20012,Kalideres Jakarta Barat,2,80,55,1400000000,DKI Jakarta
Rumah Strategis hanya 5 menit ke SMA Citra Kasih Jakarta KPR J 18089,Kalideres Jakarta Barat,3,160,138,2140000000,DKI Jakarta
Dijual rumah seken 2 lantai di Mahogany Residence siap KPR J 11695,Cimanggis Depok,3,160,128,2360000000,Jawa Barat
Rumah Jalan keadilan Dijual 2 Lantai SHM Dekat ST Kota,Taman Sari Jakarta Barat,2,42,27,520000000,DKI Jakarta
Dijual Murah Rumah Aesthetic Dekat Suhat Bisa KPR,Lowokwaru Malang,2,36,72,589000000,Jawa Timur
Rumah Idaman di Legenda Wisata Colombus Siap Nego Bisa KPR J 16307,Gunung Putri Bogor,4,105,136,1780000000,Jawa Barat
Dijual rumah siap huni di Jatiasih Residence lokasi dekat Tol J 18067,Jatiasih Bekasi,2,75,80,810000000,Jawa Barat
Dijual Rumah Jl Bogen,Tambaksari Surabaya,2,66,36,450000000,Jawa Timur
Rumah Strategis Dijual di Forest Hill Harga Nego Bisa KPR J 17007,Cisauk Tangerang,2,39,70,540000000,Banten
dijual rumah seken siap huni di foresh hill harga nego J 12788,Parung Panjang Bogor,2,39,72,540000000,Jawa Barat
Rumah Bebas Banjir Dijual di Grand View Karawaci Harga All In J 16464,Karawaci Tangerang,2,36,72,800000000,Banten
Rumah 2 Lantai di Perumahan Telaga Golf Sawangan Harga Nego J 14593,Sawangan Depok,3,81,128,1880000000,Jawa Barat
Jual Rumah Minimalis hanya 15 menit ke Stasiun Bekasi Bisa KPR J 17937,Babelan Bekasi,2,54,66,830000000,Jawa Barat
Rumah di Royal Residence Dekat Terminal Bekasi Harga All In J 15183,Tambun Utara Bekasi,3,90,100,1280000000,Jawa Barat
Rumah di Grand Depok City Dekat Cibinong Square Harga All In J 7952,Cilodong Depok,4,100,90,1340000000,Jawa Barat
Villa 3 BR terletak di area pantai wilayah strategis di Jimbaran,Jimbaran Badung,3,125,80,1500000000,Bali
Rumah dua lantai murah dijual cepat di Meruyung Limo Depok Nego,Depok,3,150,90,780000000,Jawa Barat
Rumah Ready Graha Raya Bintaro Jaya 3 Kamar Lokasi Strategis Dekat Tol,Serpong Utara Tangerang Selatan,3,87,120,1800000000,Banten
Dijual rumah baru ready siap huni jalan lio jakarta timur,Cakung Jakarta Timur,3,72,45,1058090000,DKI Jakarta
Rumah Baru 3 Kamar 7 Menit ke Stasiun Bojong Gede Cicilan 2 JUTA an,Bojong Gede Bogor,3,40,72,446000000,Jawa Barat
Rumah 2 in 1 Dayana Sumarecon Bandung,Gedebage Bandung,4,130,132,2150000000,Jawa Barat
Dp 0 KPR Bank Syariah di Rumah Asri hunian asri dan nyaman,Pesanggrahan Jakarta Selatan,2,36,63,750000000,DKI Jakarta
Rumah dijual Perumahan Metland Cileungsi Bogor,Cileungsi Bogor,2,72,60,350000000,Jawa Barat
Dijual Rumah Cluster Cantik Cempaka Putih Jakarta Pusat,Cempaka Putih Jakarta Pusat,3,116,39,1650000000,DKI Jakarta
Jual Rumah Siap Huni Bisa KPR 7 menit ke Mall Ciputra Cibubur J 17624,Cibubur Jakarta Timur,3,140,90,1170000000,DKI Jakarta
Rumah murah di jual di jakarta barat Tamansari,Taman Sari Jakarta Barat,2,47,24,590400000,DKI Jakarta
Aquila Valley Tipe Kasuari,Ciseeng Bogor,2,32,60,328000000,Jawa Barat
Rumah Murah 2lantai Termurah jakarta timur Dekat tol cibubur dan lrt,Jagakarsa Jakarta Selatan,3,105,70,1200000000,DKI Jakarta
Rumah baru dijual lokasi strategis shm di jakarta cipinang muara,Cipinang Muara Jakarta Timur,2,68,35,805600000,DKI Jakarta
RUMAH MEWAH SCANDINAVIAN PERUM SUKOHARJO RESIDENCE JL KALIURANG KM 12,Ngaglik Sleman,3,150,121,1690000000,DI Yogyakarta
Rumah untuk Keluarga Kecil,Jabungan Semarang,1,60,60,135000000,Jawa Tengah
Jual CEPAT Rumah Minimalis Citraland Surabaya TerMURAH,Citraland Surabaya,3,104,120,1160000000,Jawa Timur
The Primerose Emerald dekat stasiun Cikarang,Bekasi,2,34,60,185000000,Jawa Barat
Dijual Rumah Baru lokasi strategis di jakarta timur Cipinang Elok,Cipinang Melayu Jakarta Timur,2,42,22,524000000,DKI Jakarta
Dijual Cepat Rumah Kontrakan Murah Tebet jakarta selatan,Tebet Jakarta Selatan,2,44,44,500000000,DKI Jakarta
Dijual Rumah Strategis di Duren Sawit Komplek Ikip Bisa Nego J 16077,Duren Sawit Jakarta Timur,3,120,116,1680000000,DKI Jakarta
Dijual Rumah Industrial Modern Siap KPR di Kavling DKI Meruya J 18632,Kembangan Jakarta Barat,3,137,124,2720000000,DKI Jakarta
Jual Rumah Minimalis Dekat RS Ananda Bekasi Siap Huni Bisa KPR J 18540,Pondok Gede Bekasi,2,36,78,990000000,Jawa Barat
Rumah baru murah lokasi strategis dijakarta barat taman sari,Taman Sari Jakarta Barat,2,48,24,629000000,DKI Jakarta
Hunian mewah 2 Lantai hanya booking 5 juta Cinangka Depok,Cinangka Depok,3,72,90,1500000000,Jawa Barat
Dijual rumah siap huni di Suhat dekat kampus Brawijaya Malang,Lowokwaru Malang,4,98,120,2250000000,Jawa Timur
Rumah Cluster Premium berkonsep Kota Mandiri di Bekasi,Babelan Bekasi,3,69,72,900000000,Jawa Barat
PROMO SPESIAL Cluster Gaya Jepang Cuma 250Juta Dekat Tol Sentolo,Sentolo Kulon Progo,2,36,71,250000000,DI Yogyakarta
Rumah Subsidi DP 2 Juta di Babelan Bekasi Cicilan Flat sampai lunas,Babelan Bekasi,2,27,60,181000000,Jawa Barat
Rumah Subsidi DP 2 Jt All In Suropati Residence Bekasi,Tambun Utara Bekasi,2,25,60,185000000,Jawa Barat
2Lantai 2 juta All In DP0 4 juta bulan Kota Bogor 5 Menit Ke Stasiun,Tanah Sareal Bogor,3,80,72,665000000,Jawa Barat
PROMO free uang muka,Rajeg Tangerang,2,36,60,181000000,Banten
DIJUAL VILLA DHARMAN SANUR TROPICAL VIBES DI BALI,Sanur Denpasar,2,110,106,2117000000,Bali
Dijual hunian nyaman keadilan Jakarta barat,Jakarta Barat,2,48,25,436600000,DKI Jakarta
CITRALAND SURABAYA BARAT TERMURAH HANYA 900JUTAan,Graha Surabaya,3,70,55,900000000,Jawa Timur
Rumah di jual Butuh cepat kawasan Tirto Taruno 500m Univ Unmuh Malang,Lowokwaru Malang,3,100,165,600000000,Jawa Timur
2 lt promo rumah kota bandung timur jatihandap antapani cluster mahaka,Antapani Bandung,2,45,45,479000000,Jawa Barat
DIJUAL RUMAH CLUSTER 2 LANTAI LOKASI STRATEGIS DICIRACAS JAKARTA TIMUR,Ciracas Jakarta Timur,3,50,62,940000000,DKI Jakarta
Golden Park 3 Tipe Eyrine Plus,Cisauk Tangerang,2,29,50,575000000,Banten
Jual Murah Rumah 2 lantai Cluster Beryl PHG Summarecon Gading Serpong,Gading Serpong Tangerang,4,170,128,2800000000,Banten
DEKAT MERR SURABAYA HARGA 500 JUTAAN CLUSTER MEWAH FASUM TERLENGKAP,Gunung Anyar Surabaya,2,32,72,500000000,Jawa Timur
Jual Rumah Strategis 10 menit ke Cibinong City Mall Harga Nego J 17779,Cibinong Bogor,2,60,102,570000000,Jawa Barat
Jarang Ada Rumah Baru Mewah Berkualitas Full Furnish Area Maguwoharjo,Maguwoharjo Sleman,4,185,120,2357000000,DI Yogyakarta
RUMAH SUBSIDI BERKUALITAS DI BARAT BOGOR DP Ringan Bebas Bea Surat2,Ciampea Bogor,2,27,60,185000000,Jawa Barat
Rumah Mungil Recomended hanya 200m dari stasiun Cikoya Tangerang,Palmerah Jakarta Barat,2,30,60,185000000,DKI Jakarta
Di jual Rumah murah mewah 2 lantai villas yogyakarta,Depok Sleman,3,120,81,1175000000,Jawa Barat
Rumah Terjangkau Dekat Pusat Kota Soreang,Soreang Bandung,2,36,60,165000000,Jawa Barat
Anwa Residence Tipe 60 98,Kembangan Jakarta Barat,3,98,60,1762200000,DKI Jakarta
Rumah Murah di Gamping Sleman Bonus Mezzanine,Gamping Sleman,2,40,76,535600000,DI Yogyakarta
Jual Cepat Rumah 2 Lantai Cluster Vineyard The Green BSD City,Bumi Serpong Damai Tangerang Selatan,3,100,144,2550000000,Banten
Cluster Orchid Tipe Neo Agathis,Gunung Putri Bogor,3,62,75,1137764,Jawa Barat
Rumah Subsidi The Arthera Hill cikarang dekat kawasan MM,Bekasi,2,34,60,185000000,Jawa Barat
Rumah Murah Wisma Asri Cibening Cicilan Flat Setu Bekasi,Setu Bekasi,2,30,60,181000000,Jawa Barat
Villa Mewah Harga Murah,Ungasan Badung,3,126,131,3400000000,Bali
Rumah Exclusif Murah di Tangerang dkt KRL cikoya 200m,Grogol Petamburan Jakarta Barat,2,30,60,185000000,DKI Jakarta
Termurah Rumah 2 Lantai Cluster illustria Eminent BSD City,Bumi Serpong Damai Tangerang Selatan,3,114,144,2900000000,Banten
Darmawangsa Residence Cluster Sriwijaya Waterfront Tipe Astha Suite,Tambun Utara Bekasi,2,34,78,692640000,Jawa Barat
Jarang ada Rumah 2 Lantai Cluster Starling The Spring Gading Serpong,Gading Serpong Tangerang,3,133,136,2650000000,Banten
JUAL RUMAH EDISON GADING SERPONG SIAP HUNI TURUN HARGA MURAH,Gading Serpong Tangerang,3,110,142,2300000000,Banten
Jual Murah Rumah 2 Lantai Cluster Monaco Village Gading Serpong,Gading Serpong Tangerang,4,170,147,2400000000,Banten
Rumah Recomended di Tangerang dekat stasiun Cikoya KRL dgn Dp Ringan,Grogol Petamburan Jakarta Barat,2,30,60,185000000,DKI Jakarta
Dijual Rumah Bebas Banjir Dekat Taman Jajan Serpong Jaya J 17632,Serpong Tangerang Selatan,2,36,63,830000000,Banten
Rumah Subsidi Recomended dekat stasiun Cikoya Tangerang,Kebayoran Lama Jakarta Selatan,2,30,60,185000000,DKI Jakarta
Termurah Rumah 2 Lantai Villa Kalijudan Indah Surabaya,Kalijudan Surabaya,4,125,120,1600000000,Jawa Timur
Paradise Serpong City Tipe Grayson,Setu Tangerang Selatan,3,85,84,1622000000,Banten
Dar es Salaam Residence Tipe 54,Jatiwangi Majalengka,2,54,105,525000000,Jawa Barat
Cluster The Northbend Tipe 8x12 Metland Cyber City,Karang Tengah Tangerang,4,102,96,2627503270,Banten
Golden Park 2 Tipe Ebony,Cisauk Tangerang,2,42,60,850000000,Banten
Golden Park 3 Tipe Rhea Premium Plus Hook,Cisauk Tangerang,3,52,92,1199000000,Banten
Golden Park 3 Tipe Oryza Mezzanine,Cisauk Tangerang,2,39,60,853860000,Banten
Adhi City Sentul Tipe Agra Deluxe,Sentul Bogor,3,70,120,1630000000,Jawa Barat
Cluster Garnet Place Tipe Townhomes 2BR AKR GEM City,Manyar Gresik,2,43,40,728085000,Jawa Timur
Tipe La Venoza Cifest,Cikarang Selatan Bekasi,3,100,136,1636150000,Jawa Barat
Hacaca Village Tipe Acacia,Tarumajaya Bekasi,2,36,60,670000000,Jawa Barat
Hacaca Village Tipe Bellflower,Tarumajaya Bekasi,3,60,96,1095000000,Jawa Barat
Tjokro Boulevard Tipe 65,Sewon Bantul,2,65,60,770000000,DI Yogyakarta
Tanakayu Svadhi Tipe 5 BSD City,Pagedangan Tangerang,3,70,50,1703831000,Banten
Zena Co Living Tipe 103 35 Zena Exclusive Shared House BSD City,Pagedangan Tangerang,3,103,35,1830000000,Banten
Tanakayu Vasya BSD City Tipe 7,Pagedangan Tangerang,3,137,84,3352955000,Banten
Rumah 1 Lantai Citraland Driyorejo Gresik,Driyorejo Gresik,1,45,75,900000000,Jawa Timur
Cluster Evergreen Tipe Valerian Tri Parkland Podomoro Karawang,Karawang Barat Karawang,3,142,120,2560000000,Jawa Barat
Aquila Valley Tipe Kasuari,Ciseeng Bogor,2,32,60,328000000,Jawa Barat
Di Jual Rumah Cluster DKI Jakarta,Cengkareng Jakarta Barat,3,100,47,1485000000,DKI Jakarta
Ayodhya Garden Tipe Clover 7x16,Cikokol Tangerang,4,138,112,2695000000,Banten
Rumah 2 lantai termurah 700jt an di pusat kota Depok,Cilodong Depok,3,56,60,765000000,Jawa Barat
Dijual Rumah 3kt dekat aeon mall Freja Suites bsd Full Furnished,Pagedangan Tangerang,3,50,50,1725000000,Banten
Mutiara Damai Cipayung Tipe B,Cipayung Jakarta Timur,4,103,78,1654380000,DKI Jakarta
Rumah Dijual di Paradise Serpong Minimalis Harga All In KPR J 6422,Pamulang Tangerang Selatan,2,65,75,870000000,Banten
Jual Rumah 2 Lantai di Depok Tipe LB 72 LT 60,Depok,4,72,60,1081000000,Jawa Barat
Dijual Rumah di Bojong Ada Tempat Usaha Dekat Exit TOL Bojong,Bojong Pekalongan,2,72,72,235000000,Jawa Tengah
Rumah dekat McDonald s Cipayung Jakarta Timur,Cipayung Jakarta Timur,2,55,35,535000000,DKI Jakarta
Rumah di Permata Cimanggis Cluster Kumala Depok Harga All In J16042,Cimanggis Depok,2,70,84,920000000,Jawa Barat
Dijual rumah mewah di Cempaka putih,Cempaka Putih Jakarta Pusat,2,77,3,1395000000,DKI Jakarta
Jual Rumah Siap Huni Bebas Banjir Harga Terbaik di Area Bekasi J 17721,Setu Bekasi,3,83,96,767000000,Jawa Barat
Rumah Subsidi Lokasi Strategis Murah Cicilan Flat,Gunung Sindur Bogor,1,24,60,181000000,Jawa Barat
Graha Tirta Asri Tipe Lotus,Ciseeng Bogor,2,45,91,760000000,Jawa Barat
Dijual rumah murah siap huni ingenia eminent bsd city,Bumi Serpong Damai Tangerang Selatan,3,114,136,2750000000,Banten
Rumah Minimalis,Bangetayu Wetan Semarang,2,41,73,355000000,Jawa Tengah
Dijual Cepat Rumah Prestigia Eminent Bsd Rapih Siap Huni,Tangerang,3,90,105,2500000000,Banten
Cluster UENOS HOUSE Tipe N Cimanggis Golf Estate,Tapos Depok,2,56,64,990000000,Jawa Barat
Jual Rumah Rapih di Bintaro sektor 1 Jl Merak Posisi Strategis,Bintaro Jakarta Selatan,3,120,180,2700000000,DKI Jakarta
DIJUAL RUMAH DI MAKASSAR TODOPULI 10,Panakkukang Makassar,4,93,99,900000000,Unknown
Rumah baru dijakarta mewah lokasi strategis dijual dijakarta timur,Rawamangun Jakarta Timur,2,54,30,914900000,DKI Jakarta
Rumah Strategis hanya Selangkah ke Kota Cinema Mall Harga Nego J 16950,Jatiasih Bekasi,4,120,84,1610000000,Jawa Barat
