Judul,Alamat,Kamar Tidur,Luas Bangunan,Luas Lahan,Harga,Provinsi
Rumah mewah termurah dekat kampus brawijaya,Dinoyo Malang,3,60,69,662000000,Jawa Timur
Rumah Minimalis di Cibinong Hanya Selangkah Ke Rs Islam Aysha J 16207,Bojong Gede Bogor,2,21,60,500000000,Jawa Barat
DIJUAL Rmh Bukit Rivaria Sawangan KT 3 KM 2 LB 100 LT 90 2200 watt,Sawangan Depok,3,100,90,800000000,Jawa Barat
Jual Termurah Caelus Greenwich BSD City Jarang Ada Siap Huni Lokasi,Lengkong Kulon Tangerang,4,146,112,3800000000,Banten
RUMAH 2 LANTAI SEBESAR INI DI JATIASIH BEKASI CUMA 500 JUTAAN,Jatiasih Bekasi,3,60,70,549000000,Jawa Barat
Panorama Sepatan 1 Tipe 55 60,Sepatan Timur Tangerang,3,55,60,673675000,Banten
Panorama Sepatan 1 Tipe 45 50,Sepatan Timur Tangerang,2,45,50,565200000,Banten
Golden Kencana Tangerang Tipe Aurum Basic Plus,Curug Tangerang,2,33,50,599000000,Banten
DI JUAL RUMAH MURAH SECOND DEKAT JALAN JUANDA SUGUTAMU DEPOK,Sukmajaya Depok,2,84,94,700000000,Jawa Barat
Rumah Strategis 10 Menit Ke Mall Bintaro Jaya Harga All In KPR J 15479,Ciputat Tangerang Selatan,2,80,82,950000000,Banten
Termurah Rumah 2 Lantai Cluster Menaggio Village Gading Serpong,Gading Serpong Tangerang,4,181,170,3475000000,Banten
Rumah Hanya 10 Menit ke Gerbang Tol Cibubur 2 Siap Nego Harga J 15772,Ciracas Jakarta Timur,2,50,71,940000000,DKI Jakarta
Dijual Cepat Rumah Minimalis Modern Di Cluster Windelrio Yasmin,Bogor Barat Kota Bogor,3,136,126,1600000000,Jawa Barat
Jual Rumah Strategis 15 Menit ke Cibinong Square Mall bisa KPR J 15955,Cibinong Bogor,2,60,60,490000000,Jawa Barat
Ready Unit Rumah Jogja Lokasi Strategis di Jogja dekat dengan Kampus,Sedayu Bantul,2,40,86,400000000,DI Yogyakarta
Rumah di Cluster Swadaya Asri 3 Bintaro Harga Nego Siap KPR J 11916,Bintaro Tangerang Selatan,3,75,100,1130000000,Banten
Bumi Bantar Panjang Tipe Tulip,Tigaraksa Tangerang,2,31,60,300727500,Banten
ready stock rumah didalam perumahan 2jt sdh all in biaya dkt stasiun,Tajur Halang Bogor,2,45,72,380000000,Jawa Barat
Jual Rumah Minimalis di Cipta Graha Permai Siap KPR Bisa Nego J 19032,Cibinong Bogor,2,60,84,750000000,Jawa Barat
Jual Cepat Rumah 2 Lantai Cluster Newton Scientia Gading Serpong,Gading Serpong Tangerang,3,150,126,2500000000,Banten
BuC For sale villa freehold includes furniture and nice view,Kayuputih Buleleng,1,115,115,800000000,Bali
Perumahan dasana indah bonang Cluster Baru Bebas Banjir 400 jt an,Kelapa Dua Tangerang,2,38,60,485000000,Banten
DIJUAL VILLA IDAMAN DI JIMABARAN BALI DEKAT OBJEK WISATA,Denpasar,2,120,103,1980000000,Bali
Rumah 2 Lantai Modern Siap Huni di Kota Jombang,Jombang Jombang,3,105,89,875000000,Jawa Timur
Rumah Mewah Soreang Hanya 5 Menit ke Gerbang Tol Soreang Bandung,Soreang Bandung,3,84,71,1374180000,Jawa Barat
Lavon I Swancity Tipe D,Sindang Jaya Tangerang,3,112,96,1607000000,Banten
Lavon 2 Swancity Tipe B,Sindang Jaya Tangerang,4,92,77,1236000000,Banten
Cluster Basanta Tipe Burnet at Suvarna Sutera,Cikupa Tangerang,3,101,84,1249800000,Banten
Grand Dukuh Indah,Kramat Jati Jakarta Timur,3,156,90,3000000000,DKI Jakarta
RUMAH DIJUAL DI TUAH KARYA UJUNG TRIMADANI HOUSE HANYA 5 UNIT,Tampan Pekanbaru,3,82,152,597000000,Unknown
Harvest Serpong Residence 1 unit only,Serpong Tangerang Selatan,2,73,72,1299000000,Banten
Cluster Bluebell Tipe 36 Samesta Parayasa,Parung Panjang Bogor,2,36,72,524000000,Jawa Barat
Sriwijaya Garden Tipe 118 98,Sei Buah Palembang,4,118,98,977004000,Unknown
Rumah dekat Buduran,Sidoarjo,2,36,72,448000000,Jawa Timur
Rumah Murah di Citra Indah Bukit Bougenville Jonggol Bogor,Jonggol Bogor,2,38,90,315000000,Jawa Barat
Lavon 2 Swancity Tipe H,Sindang Jaya Tangerang,4,166,72,1865000000,Banten
Dijual Rumah Mungil Cantik Harga Nego Di Bekasi Timur,Bekasi Timur Bekasi,2,70,96,1500000000,Jawa Barat
Mata Raya Tipe 34,Kramatwatu Serang,2,34,72,294000000,Banten
RUMAH DIJUAL 2 LANTAI STRATEGIS DEKAT STASIUN SUDIMARA JOMBANG,Jombang Tangerang Selatan,3,138,88,1700000000,Banten
Cluster Bluebell Tipe 45 Samesta Parayasa,Parung Panjang Bogor,3,45,96,688000000,Jawa Barat
Cendana Botanic Type 2B,Kelapa Dua Tangerang,3,68,74,894000000,Banten
Cluster New Bougenville Tipe 36 Samesta Parayasa,Parung Panjang Bogor,2,36,72,476000000,Jawa Barat
Griya Permata Tonjong Tipe Sapphire,Tajurhalang Bogor,2,36,73,337440000,Jawa Barat
DIJUAL RUMAH 257 JUTA DEKAT RSUD SUKOHARJO,Sukoharjo Sukoharjo,2,36,73,257000000,Jawa Tengah
Rumah clusik erofa Pesona Green Royal Jakarta Bambu Apus,Bambu Apus Jakarta Timur,3,75,74,1150000000,DKI Jakarta
DIJUAL RUMAH murah di kota sukoharjo lokasi dekat RSUD sukoharjo,Sukoharjo Sukoharjo,2,36,73,272000000,Jawa Tengah
Lavon 2 Swancity Tipe F,Sindang Jaya Tangerang,3,124,54,1217000000,Banten
Rumah Forest Mansion dekat tol gunungsari dan UNESA bebas banjir SHM,Lakarsantri Surabaya,3,150,120,1550000000,Jawa Timur
Cluster Alamanda Tipe 36 Samesta Parayasa,Parung Panjang Bogor,2,36,102,491000000,Jawa Barat
Dijual Rumah 2 Lantai di Jatinegara Lio Cakung Jakarta Timur,Cakung Jakarta Timur,3,45,45,970000000,DKI Jakarta
Perumahan Islam Karakter Islamic Green Garden Rumah Syariah Bandung,Cileunyi Bandung,2,52,66,390500000,Jawa Barat
Cluster New Bougenville Tipe 45 Samesta Parayasa,Parung Panjang Bogor,2,45,96,626000000,Jawa Barat
Graha Trucuk Sejahtera T45 Klaten,Trucuk Klaten,2,45,124,318600000,Jawa Tengah
JUAL RUGI Rumah Baru CENDANA PEAK Karawaci SIAP HUNI,Karawaci Tangerang,2,53,50,990000000,Banten
Rumah baru redy jakrta pusat,Rawamangun Jakarta Timur,3,90,58,2473684210,DKI Jakarta
Vila Kebun Raya Cibinong Estate Tipe 40 Mezzanine,Cibinong Bogor,2,40,60,695000000,Jawa Barat
Dijual rumah murah bandung timur cileunyi,Cileunyi Kulon Bandung,4,104,78,550000000,Jawa Barat
Dijual Rumah Area Bekasi Jatiasih Bisa Cicilan,Jatiasih Bekasi,2,36,60,400000000,Jawa Barat
Dijual Murah Rumah Aesthetic di Lowokwaru Dekat Suhat,Lowokwaru Malang,2,36,72,589000000,Jawa Timur
dijual rumah baru minimalis sleman jogja,Kalasan Sleman,3,67,111,750000000,DI Yogyakarta
Grand Dahlia Cluster Depok,Cilodong Depok,2,48,45,643800000,Jawa Barat
HARUS LAKU BULAN INI BU DIJUAL CEPAT RMH KRIAN KOTA MANDIRI RESIDENCE,Krian Sidoarjo,2,45,104,589500000,Jawa Timur
Rumah Jember Subsidi Kampus Terlaris Tanpa Uang Muka,Sumbersari Jember,2,27,66,150000000,Jawa Timur
Rumah subsidi Pallangga,Pallangga Gowa,2,36,72,173000000,Unknown
RUMAH SUBSIDI TANPA MODAL AREA JATIROGO UKURAN TANAH JUMBO,Bancar Tuban,2,30,90,141900000,Jawa Timur
Green Permata Sawangan II Depok Sawangan Jawa Barat,Sawangan Depok,2,36,60,300000000,Jawa Barat
Cluster Basanta Tipe Bloom at Suvarna Sutera,Cikupa Tangerang,3,87,72,1074600000,Banten
Dijual Rumah depan taman Citra Maja Raya,Maja Lebak,2,36,72,215000000,Banten
Alibaba Village mulai 6OO jutaan dekat paolo fest kota batu,Oro oro Ombo Batu,2,45,60,672000000,Jawa Timur
RUMAH BARU CICILAN RINGAN DI PERUMNAS 2 SENTRA LAND PARUNG PANJANG,Parung Panjang Bogor,2,36,133,499000000,Jawa Barat
promo 5OO jutaan villa dekat alun alun kota batu,Oro oro Ombo Batu,2,47,60,550000000,Jawa Timur
VILLA STYLE SANTORINI TERMURAH DI JIMBARAN BALI,Jimbaran Badung,2,50,100,1250000000,Bali
luxury new brand villa modern ubud terbatas hanya 6 unit,Ubud Gianyar,3,120,160,2300000000,Bali
Cluster Basanta Tipe Bellflower at Suvarna Sutera,Cikupa Tangerang,4,122,96,1479600000,Banten
Dijual rumah mewah dekat kuliner taman solo Jakarta pusat,Cempaka Putih Jakarta Pusat,3,68,45,1480000000,DKI Jakarta
Cluster Patragriya at Podomoro Park Bandung,Buahbatu Bandung,2,43,66,900000000,Jawa Barat
Jual rumah Baru minimalis siap huni depok,Cilodong Depok,3,90,50,625000000,Jawa Barat
Cluster Bluebell Tipe 27 Samesta Parayasa,Parung Panjang Bogor,2,27,60,370000000,Jawa Barat
Rumah 10 Menit ke Gerbang Tol BSD Barat 1 Harga All In KPR J 16124,Bumi Serpong Damai Tangerang Selatan,2,54,72,960000000,Banten
Rumah Siap Huni Bisa KPR di Perumahan Rafles Hills Harga Nego J 19078,Tapos Depok,2,78,90,1380000000,Jawa Barat
Rumah 1 lantai dengan mezzanine 600juta an,Depok Depok,3,46,60,692000000,Jawa Barat
Rumah baru dkt padasuka Cikutra surapati pusdai cisaranten sport jabar,Cikutra Bandung,2,33,50,350000000,Jawa Barat
DI JUAL RUMAH KOMPLEK OMAHA VILLAGE DAVENPORT KELAPA DUA,Tangerang,3,116,80,2500000000,Banten
Rumah Strategis Dekat Metropolitan Land Cileungsi Harga All In J 17843,Cileungsi Bogor,4,130,90,870000000,Jawa Barat
Rumah Dp 0 dekat Tol Caringin Bogor,Caringin Bogor,2,36,66,299250000,Jawa Barat
Rumah di Serpong Garden Dekat Tol BSD Barat 1 Harga All In KPR J 16125,Bumi Serpong Damai Tangerang Selatan,3,88,78,1350000000,Banten
Rumah Strategis 7 menit ke Gerbang TOL Burangkeng Harga All In J 15998,Setu Bekasi,2,30,60,660000000,Jawa Barat
Rumah Minimalis Siap Nego di Bali Resort Bebas Banjir Bisa KPR J 17691,Gunung Sindur Bogor,2,56,86,800000000,Jawa Barat
Griya Bintaro Estate,Tangerang Selatan,3,68,60,1298900000,Banten
Rumah Baru Attic Strozzi di Gading serpong,Gading Serpong Tangerang,3,161,96,3120000000,Banten
Dijual Rumah Tipe A10 LB LT 40 81 di Villa Viscaria,Cikarang Timur Bekasi,2,40,81,330000000,Jawa Barat
Rumah Mewah Murah di Bogor Nirwana Residence,Bogor Selatan Kota Bogor,3,75,150,980000000,Jawa Barat
Taman mumbul suite rumah cluster mewah kawasan mumbul Nusa dua,Nusa Dua Badung,3,100,100,1905000000,Bali
Jual Rumah Siap Huni Perumahan Kedungturi Permai Taman Sidoarjo,Taman Sidoarjo,3,118,84,700000000,Jawa Timur
Villa modern minimalis view laut di Ungasan,Ungasan Badung,2,125,100,2000000000,Bali
Jual Nego Rumah di Kota Wisata Cluster Toronto Siap KPR J 14061,Cileungsi Bogor,2,54,90,1250000000,Jawa Barat
dijual cepat rumah di beruang raya BU,Semarang Timur Semarang,2,70,116,1400000000,Jawa Tengah
RUMAH MODERN CLASSIC SIAP HUNI SEMI FURNISHED IL LAGO GADING SERPONG,Gading Serpong Tangerang,4,150,136,3550000000,Banten
Jual Cepat rumah Inika The Avani BSD,Bumi Serpong Damai Tangerang Selatan,3,128,162,2500000000,Banten
Dijual Rumah Bebas Banjir Siap Huni Suvarna Sutera Tangerang J 15918,Cikupa Tangerang,3,79,66,970000000,Banten
Rumah Minimalis Dekat Harapan Indah Bekasi Siap KPR Bisa Nego J 19047,Harapan Indah Bekasi,2,60,60,690000000,Jawa Barat
Dijual Rumah Area Banjarsari Manyar Gresik,Manyar Gresik,2,50,80,475000000,Jawa Timur
Suma Village Tipe 6,Curug Tangerang,3,65,72,976440000,Banten
Lavon 2 Swancity Tipe G,Sindang Jaya Tangerang,4,150,63,1409000000,Banten
Daisan Swancity Tipe The Flexible,Sindang Jaya Tangerang,3,98,50,1464000000,Banten
Jual Cepat Rumah 2 Lantai Cluster Azalea Gading Serpong,Gading Serpong Tangerang,3,150,119,2200000000,Banten
Jual Murah Rumah 2 Lantai Cluster Vivaldi Gading Serpong,Gading Serpong Tangerang,3,180,128,3200000000,Banten
DIJUAL MURAH RUMAH 2 LANTAI DI LEUWINANGGUNG TAPOS SIAP HUNI SHM,Tapos Depok,3,120,65,600000000,Jawa Barat
Dijual PALING MURAH Rumah 2 Lantai di perumahan Shojiland,Candi Sidoarjo,2,44,84,515000000,Jawa Timur
Bukit Podomoro Jakarta Tipe 6 Wales,Duren Sawit Jakarta Timur,3,123,90,4000000000,DKI Jakarta
Rumah Bisa KPR Dijual di Puri Astina Lenteng Agung Harga Nego J 18048,Jagakarsa Jakarta Selatan,3,148,121,2780000000,DKI Jakarta
Rumah Strateis di Citra Garden City Jakarta Harga All In KPR J 18807,Kalideres Jakarta Barat,4,120,90,2420000000,DKI Jakarta
Rumah Harga All In 5 menit ke Stasiun Depok Siap Huni Bisa KPR J 19064,Sukmajaya Depok,2,38,90,1180000000,Jawa Barat
Jual Rumah Minimalis Harga Nego di Pondok Ungu Permai Siap KPR J 18618,Babelan Bekasi,3,60,78,710000000,Jawa Barat
Rumah Minimalis Dijual di Batu Ceper Permai Siap Nego Bisa KPR J 18453,Kalideres Jakarta Barat,2,96,96,1100000000,DKI Jakarta
Dijual Rumah 2 Lantai Idaman Dekat Cibubur Siap Huni Bisa KPR J 15559,Cibubur Jakarta Timur,2,107,128,1881000000,DKI Jakarta
Dijual Rumah Minimalis Siap Nego Bisa KPR di Griya Loka BSD J 16047,Bumi Serpong Damai Tangerang Selatan,3,72,112,1750000000,Banten
Rumah Siap KPR Dekat Mall Paradise Walk Serpong Harga Nego J 15290,Serpong Tangerang Selatan,2,99,75,1030000000,Banten
Rumah Strategis Dekat The Breeze BSD City Harga All In KPR J 17581,Bumi Serpong Damai Tangerang Selatan,3,70,77,2030000000,Banten
Rumah 2 lantai Skandinavia minimalis dekat tol kukusan Depok,Beji Depok,2,58,50,789600000,Jawa Barat
Dijual cepat rumah 2 lantai ready stok siap huni di Serpong,Tangerang Selatan,3,80,68,1680000000,Banten
Rumah Dekat Gerbang Tol Sentul Barat Harga All In KPR J 15729,Tanah Sareal Bogor,2,54,78,820000000,Jawa Barat
DHYA Tipe DELUXE Rumah Baru Dp 0 Graha Raya,Serpong Utara Tangerang Selatan,3,62,60,1300000000,Banten
Rumah Cantik Alami di CIKARANG TIMUR dekat Kawasan Industri JABABEKA,Cikarang Timur Bekasi,2,40,81,290000000,Jawa Barat
Rumah Murah di Gondrong cipondoh,Cipondoh Tangerang,2,39,51,550000000,Banten
Perumahan Modern Harga Subsidi Segera Miliki rumah impian anda,Cempaka Banjarbaru,2,36,140,182000000,Unknown
Dijual Rumah Bagus Dua Lantai Murah Dekat UB,Lowokwaru Malang,3,80,72,880000000,Jawa Timur
Rumah dijual di Cluster Discovery Terra Bintaro Jaya Sektor 9,Bintaro Tangerang Selatan,3,142,135,3250000000,Banten
Rumah 2 Lantai Kualitas Terjamin Jl Mangga 3 Sawangan Depok,Sawangan Depok,3,107,67,658000000,Jawa Barat
Rumah elegan siap huni dekat terminal Rawamangun Jakarta timur,Rawamangun Jakarta Timur,3,90,58,2473600000,DKI Jakarta
RUMAH SIAP HUNI MAKASSAR,Tamangapa Makassar,3,60,90,675000000,Unknown
Neo Mediterania Tipe 40 66 Attic,Rajeg Tangerang,2,41,66,478600000,Banten
DIJUAL RUMAH MURAH DI PERUMAHAN METRO SERPONG SIAP NEGO J 16101,Serpong Tangerang Selatan,2,60,62,490000000,Banten
Bukit Serpong Indah Tipe Sakura,Gunung Sindur Bogor,3,50,96,633000000,Jawa Barat
Rumah Siap Huni Di Kalisari Sangat Asri Di Jual Tanpa Perantara NEGO,Kalisari Jakarta Timur,3,119,119,900000000,DKI Jakarta
Lavon I Swancity Tipe E,Sindang Jaya Tangerang,4,132,112,1795000000,Banten
DIJUAL RUMAH 2 LANTAI DENGAN HARGA MURAH READY UNIT,Karawaci Tangerang,3,120,90,800000000,Banten
Rumah dalam proses dan Ready,Sawangan Baru Depok,2,36,50,295000000,Jawa Barat
Lagoosi Village Tipe Gilenia,Mandai Maros,2,42,55,491000000,Unknown
Mutiara Gading City Tipe Topaz,Tarumajaya Bekasi,1,21,60,388000000,Jawa Barat
Rumah Ponorogo Barat Tambakbayan,Sukorejo Ponorogo,2,45,128,395000000,Jawa Timur
Rumah Bebas Banjir di Grand Akasia Residence Harga All In KPR J 17954,Pamulang Tangerang Selatan,3,50,91,1180000000,Banten
Jual Cepat Rumah Siap KPR 13 menit ke Gerbang Tol Cisalak 3 J 14506,Jagakarsa Jakarta Selatan,3,185,144,2920000000,DKI Jakarta
Rumah Industrial Modern di Bintaro Jaya Sektor 4 Harga Nego J 14473,Bintaro Tangerang Selatan,3,150,90,2200000000,Banten
Rumah Bebas Banjir Siap KPR di Perumahan Duta Indah Harga Nego J 19232,Pondok Gede Bekasi,3,157,157,1820000000,Jawa Barat
Rumah 2 Lantai di Cendana Residence Pamulang Harga All In KPR J 19184,Pamulang Tangerang Selatan,3,70,72,1470000000,Banten
Jual Rumah Minimalis di Cikeas Residence Harga All In Siap KPR J 10233,Gunung Putri Bogor,2,40,84,710000000,Jawa Barat
Rumah Bisa KPR di Bukit Golf Cluster Orchid Harga Siap Nego J 16008,Cibubur Jakarta Timur,2,90,105,1020000000,DKI Jakarta
Rumah Siap KPR 10 Menit ke Gerbang Tol BSD Barat 1 Harga Nego J 16114,Serpong Tangerang Selatan,2,41,72,960000000,Banten
RUMAH MURAH ONE GATE DI TANJUNG SENENG BANDAR LAMPUNG,Tanjung Senang Bandar Lampung,2,60,107,445000000,Unknown
Rumah rapih Magnolia Gading Serpong,Gading Serpong Tangerang,4,162,153,3000000000,Banten
Rumah rasa Baru Belum pernah di Huni di KBP,Padalarang West Bandung,3,94,120,2360000000,Jawa Barat
Dijual rumah elegan akses mobil dekat mall Arion Jakarta timur,Rawamangun Jakarta Timur,3,74,57,1815000000,DKI Jakarta
DIJUAL Rumah gratis pemasangan Kanopi,Pontianak Kota Pontianak,2,112,160,355000000,Unknown
Rumah murah dekat kota jogja Dm village sudimoro,Sewon Bantul,2,36,66,449000000,DI Yogyakarta
Perdana Kampus Jimbaran Bali Huniah mewah di jalan utama one gate,Jimbaran Badung,3,70,100,1250000000,Bali
Di Jual Rumah Mewah Modern Dekat Universitas Negeri Jakarta Jl Pemuda,Rawamangun Jakarta Timur,3,67,48,1329000000,DKI Jakarta
RUMAH SEMI FURNISHED BSD CITY FLEEKHAUZ R LOKASI STRATEGIS,Bumi Serpong Damai Tangerang Selatan,2,45,40,950000000,Banten
Bukit Serpong Indah Tipe Diaffen,Gunung Sindur Bogor,2,36,72,430000000,Jawa Barat
Daisan Swancity Tipe The Courtyard,Sindang Jaya Tangerang,4,165,77,3600000000,Banten
Daru Metropolis Cluster Illinois Tipe 22 72,Jambe Tangerang,2,22,72,230000000,Banten
Rumah Megah 2 Lantai dengan Kemudahan Akses ke Kota Solo,Baki Sukoharjo,3,75,75,600000000,Jawa Tengah
DP KPR dan MODEL RUMAH terserah Anda,Gunung Sindur Bogor,2,42,72,548000000,Jawa Barat
Villa Tanpa DP di Kota Medan,Bintaro Tangerang Selatan,2,54,84,398000000,Banten
Lagoosi Village Tipe Selena,Mandai Maros,2,33,55,375000000,Unknown
Rumah Baru Citraland Surabaya Dempsey Hill 2 Lantai dgn Pool Rooftop,Citraland Surabaya,4,105,150,1800000000,Jawa Timur
Hayfield at Grand City Balikpapan Tipe 47,Sepinggan Balikpapan,2,47,60,960690000,Unknown
Cluster Alamanda Tipe 45 Samesta Parayasa,Parung Panjang Bogor,2,45,152,644000000,Jawa Barat
Mata Raya Tipe 37,Kramatwatu Serang,2,37,72,474000000,Banten
Rumah Bisa KPR Dekat ICE BSD City Harga All In Siap Huni J 14973,Bumi Serpong Damai Tangerang Selatan,2,72,72,850000000,Banten
Rumah di Serpong City Paradise Harga All In KPR Bebas Banjir J 15290,Setu Tangerang Selatan,2,99,75,1030000000,Banten
Dijual Rumah dekat Informa Living Plaza Cinere,Cinere Depok,1,38,42,450000000,Jawa Barat
Rumah Minimalis Harga All In KPR Dekat Sentul City Siap Huni J 17835,Sentul City Bogor,4,45,90,1020000000,Jawa Barat
Rumah Siap Huni Dijual di Springhill Yume Lagoon Harga Nego J 17950,Setu Tangerang Selatan,2,46,72,1140000000,Banten
The Terrace at Ayodhya Garden Tipe Pine,Cikokol Tangerang,4,105,84,2050000000,Banten
Murah Rumah Furnished Northwest Citraland dibawah 900juta,Citraland Surabaya,4,60,50,860000000,Jawa Timur
Taman Jatayu residenc rumah mewah di kawasan Ungasan Kuta Selatan,Ungasan Badung,3,80,100,995000000,Bali
RUMAH MURAH DP RENDAH DEKAT MAKASSAR,Romangpolong Gowa,2,50,72,450000000,Unknown
RUMAH MURAH DI SALATIGA BISA CICIL TANPA BANK AKAD SYARIAH FREE UMROH,Sidomukti Salatiga,2,36,60,400000000,Jawa Tengah
Dijual Rumah 2 Lantai di jalan Pemuda Rawamangun Jakarta Timur,Rawamangun Jakarta Timur,3,74,57,1300000000,DKI Jakarta
Dijual Rumah Mewah dan Elegan Di Cipinang Baru Raya Jakarta Timur,Jakarta Timur,3,90,76,2350000000,DKI Jakarta
Dijual Rumah Mewah Dan Murah Di Villa Pesona Angrek Deli Tua,Deli Tua Deli Serdang,2,54,84,398000000,Unknown
RUMAH READY BATAS SURABAYA TANPA DP TANPA UTJ,Driyorejo Gresik,2,36,84,510000000,Jawa Timur
Rumah murah dijakarta,Cibubur Bekasi,3,84,60,930000000,Jawa Barat
Tera Regency Malang SHM lokasi dekat RS Supraoen dan Univ Kanjuruhan,Sukun Malang,2,80,84,425000000,Jawa Timur
Rumah Lebar 8 3 Lantai Citra Garden Serpong dekat Aeon Mall Toll Jorr,Bumi Serpong Damai Tangerang Selatan,4,141,120,2970000000,Banten
Jual Cepat Rumah Pancoran Barat Jaksel Cuma 1M nego,Pancoran Jakarta Selatan,4,120,78,1000000000,DKI Jakarta
Dijual Cepat Rumah Siap Huni Harga Murah Di Bogor,Tajur Halang Bogor,3,96,128,540000000,Jawa Barat
Hunian 2 lantai asri nan hijau di Sawangan Depok,Depok Depok,3,78,65,900000000,Jawa Barat
Rumah Siap Huni di Pantai Indah Singaraja,Baktiseraga Buleleng,2,70,133,515000000,Bali
Lavon I Swancity Tipe C,Sindang Jaya Tangerang,4,101,84,1497000000,Banten
Cluster Baru Dekat AEON Mall Pasar Minggu Akses Mudah Harga Murah,Pasar Minggu Jakarta Selatan,2,80,50,1000000000,DKI Jakarta
Rumah Mewah 2 Lantai di Lokasi Strategis Kota Bandung,Soekarno Hatta Bandung,3,161,160,2861388000,Jawa Barat
Kota Sutera Cluster Albizia Tipe 69,Pasar Kemis Tangerang,3,69,72,960900000,Banten
Lagoosi Village Tipe Lusera,Mandai Maros,2,45,55,517000000,Unknown
Jual Rumah style vila dekat Pantai Sanur Denpasar Timur Bali,Sanur Kaja Denpasar,3,100,100,1450000000,Bali
Rumah di Bekasi Hanya 5 Juta All In Desain Scandinavian Kaum Milenial,Bekasi Utara Bekasi,2,36,72,529970000,Jawa Barat
Vila Kebun Raya Cibinong Estate Tipe 54,Cibinong Bogor,3,54,60,838000000,Jawa Barat
Mata Raya Tipe 48,Kramatwatu Serang,2,48,84,617600000,Banten
Mata Raya Tipe 71,Kramatwatu Serang,3,71,105,995000000,Banten
Rumah Harga All In KPR di Audita Residence Dekat Stasiun Depok J 17637,Pancoran Mas Depok,3,120,105,1290000000,Jawa Barat
Rumah 2 Lantai Strategis di Komplek Sketsa Harga Nego Bisa KPR J 18460,Jagakarsa Jakarta Selatan,3,130,73,2140000000,DKI Jakarta
Rumah Minimalis di Perumahan Pamulang Elok Siap Nego Bisa KPR J 18023,Pamulang Tangerang Selatan,3,90,72,1220000000,Banten
Rumah Siap Huni di Paradise Serpong City Harga All In Siap KPR J 17955,Pamulang Tangerang Selatan,2,32,50,860000000,Banten
Rumah Strategis di Taman Victoria Sentul Harga All In Siap KPR J 17835,Cibinong Bogor,4,45,90,1020000000,Jawa Barat
Rumah Harga Nego di Graha Harapan Dekat Puskesmas Mustika Jaya J 18668,Mustika Jaya Bekasi,2,96,96,1130000000,Jawa Barat
Rumah Strategis Dekat Stasiun Rawa Buntu Siap Huni Bisa KPR J 16583,Bumi Serpong Damai Tangerang Selatan,3,90,135,2300000000,Banten
Rumah Strategis 15 menit ke Stasiun Cilebut Siap Nego Bisa KPR J 18106,Cibinong Bogor,2,60,78,790000000,Jawa Barat
Rumah murah 3 kamar tidur Terravia BSD Tangerang,Pagedangan Tangerang,3,93,66,1920000000,Banten
Rumah 1 lantai dekat stasiun Bojong gede booking 3 juta ALL IN,Bojonggede Bogor,2,40,90,663000000,Jawa Barat
Dijual cepat rumah 2 lantai siap huni di Graha Raya Bintaro,Serpong Utara Tangerang Selatan,3,107,72,1650000000,Banten
Rumah dijual 2 lantai di Serpong dekat kantor walikota Tangsel,Serpong Utara Tangerang Selatan,2,60,59,1000000000,Banten
rumah komersil termurah di sukaraja dengan luas tanah 90m,Tanah Baru Bogor,2,36,72,339000000,Jawa Barat
Rumah Murah Rawalumbu Strategis Di Cluster Kiana Caringin Rawalumbu,Bojong Rawalumbu Bekasi,3,102,84,914000000,Jawa Barat
Rumah Full Furnished ada Attic Rooftop di Tanakayu BSD Gading Serpong,Tangerang,3,137,84,2895000000,Banten
Rumah Cluster Terlaris TANPA DP Dekat Kaw Industri Toll Karawang,Klari Karawang,2,36,72,375000000,Jawa Barat
Dijual Rumah Cantik Harga Murah Dekat Suhat Dan Dekat UB,Lowokwaru Malang,3,130,72,1150000000,Jawa Timur
DP KPR dan MODEL rumah terserah pembeli,Pamulang Tangerang Selatan,2,42,72,548000000,Banten
Rumah Murah Kota Bogor Bogor Kota Bogor Barat Dramaga,Bogor,2,50,90,540000000,Jawa Barat
DP KPR dn MODEL RUMAH TERSERAH ANDA,Pamulang Tangerang Selatan,2,42,72,548000000,Banten
Rumah 3 Lantai Tanpa DP di Pusat BSD dekat Aeon Mall Qbig Toll Jorr,Bumi Serpong Damai Tangerang Selatan,4,144,84,2760000000,Banten
AMESTA LIVING GRAHA FAMILI SBY TIMUR DP 0 KPR INTILAND 0KM OERR,Gunung Anyar Surabaya,2,65,60,1000000000,Jawa Timur
Dijual rumah mewah dan cantik di cempaka putih,Cempaka Putih Jakarta Pusat,3,94,53,2400000000,DKI Jakarta
Catalia Residence 3 Tipe 60,Pondok Melati Bekasi,4,72,60,1194444444,Jawa Barat
Jual Rumah Di Dago Bandung Mewah Kodya Smart Valley,Dago Bandung,3,142,120,2800000000,Jawa Barat
Jual Cepat Rumah Hook Di Cluster Grand Mahkota Bekasi,Babelan Bekasi,2,48,144,735500000,Jawa Barat
Lavon I Swancity Tipe B,Sindang Jaya Tangerang,4,93,77,1475000000,Banten
PONDOK CANDRA CLUSTER DEPAN TERMURAH LANGSUNG TOL,Gubeng Surabaya,3,120,100,1500000000,Jawa Timur
Rumah Keren Di Cempaka Putih 2 Lantai SHM Dijual,Cempaka Putih Jakarta Pusat,2,77,39,1390000000,DKI Jakarta
Kota Podomoro Tenjo Tipe Deluxe 36,Tenjo Bogor,2,36,72,230350000,Jawa Barat
DiJual Rumah BU Lokasi Kota Batang,Watesalit Batang,3,155,185,270000000,DI Yogyakarta
Rumah Mewah Murah di Lokasi Stategis Perumahan Modern Bandung,Banjaran Bandung,2,42,84,417848000,Jawa Barat
villa 1 lantai murah santorini di taman Griya jimbaran,Taman Griya Badung,2,60,100,1450000000,Bali
Lagoosi Village Tipe Zamora,Mandai Maros,2,60,66,647000000,Unknown
Cluster Dakota Tipe Diantha at Suvarna Sutera,Cikupa Tangerang,3,147,120,2063700000,Banten
di jual hunian nyaman asri di Tanah Tinggi Jakarta pusat,Senen Jakarta Pusat,2,72,49,1176500000,DKI Jakarta
Sriwijaya Garden Tipe 48 84,Sei Buah Palembang,2,48,84,530736826,Unknown
Rumah Villa mewah harga murah di kawasan renon Denpasar,Renon Denpasar,2,85,100,2375000000,Bali
Cluster Dakota Tipe Datura at Suvarna Sutera,Cikupa Tangerang,3,126,105,1787100000,Banten
Rumah Cluster 1 Lantai Siap Huni Dekat LRT Cikunir,Jatibening Bekasi,1,72,92,1000000000,Jawa Barat
Hunian Nyaman Dengan Nilai Investasi Tinggi Budaya Cipta 1,Kediri Kota Kediri,3,125,98,1300000000,Jawa Timur
Cluster Sadyagriya at Podomoro Park Bandung,Buahbatu Bandung,2,73,90,1700000000,Jawa Barat
Cluster Wangsagriya at Podomoro Park Bandung,Buahbatu Bandung,2,82,72,1700000000,Jawa Barat
jual rumah villa kota batu dekat jatimpark 3,Batu Batu,2,74,66,949000000,Jawa Timur
Rumah 2 Lantai Siap Huni di Lippo Karawaci Free AC Cashback Jutaan,Karawaci Tangerang,2,55,60,900000000,Banten
FREE PPN 150 Juta an TYPE TUSCANY TERLARIS CITRALAND TALLASA CITY,Tamalanrea Makassar,3,90,105,1571000000,Unknown
Rumah DP 0 No Biaya No Banjir di Town house 60 Unit Jalan Msk 3 Mbl,Jagakarsa Jakarta Selatan,4,135,105,2099999000,DKI Jakarta
promo perumahan bandung barat paku haji,Ngamprah West Bandung,2,36,68,464000000,Jawa Barat
CITRALAND SURABAYA NORTH WEST 3LT DENGAN ATTIC ROOFTOP DAN LAKE VIEW,Graha Surabaya,3,148,72,1400000000,Jawa Timur
Hunian Minimalis Modern Semi Furnish Di Cibinong,Cibinong Bogor,1,36,84,550000000,Jawa Barat
Rumah baru letak sangat strategis dekat Glodok Jakarta barat,Glodok Jakarta Barat,2,42,27,520500000,DKI Jakarta
Jual Rumah Siap Huni LT 9x20 2Carport hanya 500jutaan Visenda Serang,Serang Serang,2,45,180,523000000,Banten
Jual Rumah Bukit Palma Surabaya Termurah,Pakal Surabaya,4,128,135,1380000000,Jawa Timur
RUMAH LANTAI 2 BERKONSEP VILA HANYA 2 JTAN,Gombong Kebumen,3,52,71,395000000,Jawa Tengah
Rumah siap Huni Monticello Royal Residence,Wiyung Surabaya,4,135,128,2300000000,Jawa Timur
